Unnamed: 0,id,author,published_at,updated_at,like_count,sentiment_score,text,labeled_status,unique_tokens,token_count,compound_score,positive_score,negative_score,neutral_score
0,0,swarnilakarmakar6585,2024-07-08,2024-07-08,0,-0.589474,hello sir i have tried through the methods u had showed in the do to get the it channel id but i was unable to get the id by that process please help me with this,neg,"['showed', 'hello', 'methods', 'sir', 'unable', 'please', 'get', 'id', 'process', 'u', 'help', 'tried', 'channel']",13,0.7579,0.173,0.0,0.827
1,1,anjumaurya5603,2024-07-08,2024-07-08,0,-0.850589,i am getting key error for the commentcount column i have check the code many times but still it don't resolved please any one let me know how to resolve it,neg,"['still', 'resolved', 'let', 'code', 'getting', 'please', 'key', 'error', 'many', 'know', 'commentcount', 'check', 'column', 'resolve', 'one', 'times']",16,-0.1705,0.099,0.176,0.725
2,2,DanyalTipu,2024-07-05,2024-07-05,0,-0.49801853,can someone tell me from where i can get the source code blog given in description is unavailable,neutral,"['code', 'source', 'get', 'given', 'unavailable', 'tell', 'description', 'blog', 'someone']",9,0.0,0.0,0.0,1.0
3,3,ayushjaiswal350,2024-07-03,2024-07-03,0,0.98241925,this is good,pos,['good'],1,0.4404,0.592,0.0,0.408
4,4,ChristinaK-r6n,2024-06-27,2024-06-27,0,0.9859156,thank you for putting this together it was super helpful for me,pos,"['super', 'thank', 'putting', 'together', 'helpful']",5,0.8481,0.505,0.0,0.495
5,5,saloni1148,2024-06-16,2024-06-16,0,0.19567885,can i do this project on googly colas,neutral,"['colas', 'googly', 'project']",3,0.0,0.0,0.0,1.0
6,6,bose19942,2024-06-05,2024-06-05,0,0.9778347,thank you for this video,pos,"['video', 'thank']",2,0.3612,0.385,0.0,0.615
7,7,swarnimsrijan7470,2024-05-16,2024-05-16,0,0.98379534,what a brilliant lecture really impressed by you sir thanks for helping out i the journey,pos,"['thanks', 'really', 'sir', 'brilliant', 'helping', 'lecture', 'journey', 'impressed']",8,0.9061,0.551,0.0,0.449
8,8,deepasinghal4729,2024-05-13,2024-05-13,0,-0.12183101,followed till 18:14 no error returned nothing,neutral,"['error', 'followed', 'nothing', 'returned', 'till']",5,-0.5994,0.0,0.495,0.505
9,9,rahulrajeev9763,2024-04-27,2024-04-27,0,0.985799,thank you so much for this stuff,pos,"['much', 'stuff', 'thank']",3,0.3612,0.294,0.0,0.706
10,10,mohdsaqib3241,2024-04-27,2024-04-27,0,-0.8735465,project link not working,neg,"['link', 'project', 'working']",3,0.0,0.0,0.0,1.0
11,11,yankoshuan6225,2024-04-20,2024-04-20,0,-0.6445619,i get only this out from son formatter techtfq can i continue the project i think i might will be missing most of the important stuff,neg,"['might', 'continue', 'project', 'get', 'stuff', 'formatter', 'important', 'son', 'missing', 'techtfq', 'think']",11,-0.0352,0.085,0.091,0.824
12,12,user-uv5lr7bk8n,2024-04-18,2024-04-18,0,0.93145216,for a non-tech background like me your tutorial is super easy to follow,pos,"['background', 'easy', 'follow', 'super', 'like', 'tutorial']",6,0.8519,0.508,0.0,0.492
13,13,najam00717,2024-04-01,2024-04-01,0,-0.6600635,why the son is not showing likes ?,neg,"['likes', 'showing', 'son']",3,-0.3252,0.0,0.28,0.72
14,14,Abutturab,2024-03-28,2024-03-28,0,0.43924892,top !,neutral,['top'],1,0.2714,1.0,0.0,0.0
15,15,ryang8192,2024-03-21,2024-03-21,1,-0.068803795,hello i want to ask how to receive video data from youtube?,neutral,"['hello', 'receive', 'youtube', 'want', 'video', 'ask', 'data']",7,0.0772,0.115,0.0,0.885
16,16,VARUNKUMAR-dj6mi,2024-03-04,2024-03-04,0,-0.38621366,"54:45 in my scrapping i didn't have snippet , title name and likes and views in this only showing video it'd and published date please any one help me tomorrow i have interview",neutral,"['title', 'likes', 'please', 'snippet', 'tomorrow', 'date', 'help', 'interview', 'scrapping', 'views', 'name', 'video', 'published', 'showing', 'one']",15,0.7783,0.224,0.0,0.776
17,17,VARUNKUMAR-dj6mi,2024-03-04,2024-03-04,0,-0.22150673,"54:45 in my scrapping i didn't have snippet , title name and likes and views in this only showing video it'd and published date please any one 54:45 help me tomorrow i have interview",neutral,"['title', 'likes', 'please', 'snippet', 'tomorrow', 'date', 'help', 'interview', 'scrapping', 'views', 'name', 'video', 'published', 'showing', 'one']",15,0.7783,0.218,0.0,0.782
18,18,internetmaxvui7719,2024-02-28,2024-02-28,0,-0.8554377,sorry sir the link project in the description is dead,neg,"['project', 'sorry', 'sir', 'dead', 'description', 'link']",6,-0.6808,0.0,0.412,0.588
19,19,vigneshnesh7353,2024-02-22,2024-02-22,0,-0.82392263,brow project download link not working,neg,"['project', 'brow', 'download', 'working', 'link']",5,0.0,0.0,0.0,1.0
20,20,hoperight5280,2024-02-21,2024-02-21,0,0.71925104,amazing,pos,['amazing'],1,0.5859,1.0,0.0,0.0
21,21,user-ye8xi6kf3q,2024-02-18,2024-02-18,0,0.987296,i have to say that you are very great...i am following your channel.your projects are just amazing for getting job,pos,"['projects', 'following', 'getting', 'job', 'say', 'great', 'amazing']",7,0.5859,0.174,0.0,0.826
22,22,mayankjacky,2024-02-12,2024-02-12,1,0.26092035,thanks,neutral,['thanks'],1,0.4404,1.0,0.0,0.0
23,23,mayankjacky,2024-02-12,2024-02-12,1,0.97828966,a great video which covers all aspects of creating a project in python for data science thank you for your service to the community at large regards,pos,"['python', 'covers', 'project', 'large', 'service', 'thank', 'great', 'video', 'regards', 'science', 'community', 'data', 'creating', 'aspects']",14,0.8316,0.286,0.0,0.714
24,24,user-hl4xm6bg3f,2024-02-10,2024-02-10,0,-0.49792266,"techtfq i am getting this error what should i does c:\users\mypho\onedrive\desktop\capstone project & c:/users/mypho/anaconda3/python.exe ""c:/users/mypho/onedrive/desktop/capstone project/capstone.py"" traceback : file ""c:\users\mypho\onedrive\desktop\capstone project\capstone.py"", line i in module couture build ^^^^^^^^^^^^^^^^^^^^^^^^^^^^^^^^^^^^^^^^^^^^^ file ""c:\users\mypho\anaconda3\lib\site-packages\googleapiclient\_helpers.py"", line 130, in positional_wrapper return wrapped ^^^^^^^^^^^^^^^^^^^^^^^^",neutral,"['module', 'wrapped', 'couture', 'project', 'getting', 'c', 'error', 'file', 'line', 'return', 'techtfq', 'build', 'traceback', '130']",14,-0.481,0.0,0.092,0.908
25,25,neerajsuryawanshi836,2024-02-03,2024-02-03,0,0.077313066,thanks for sharing informative content can anybody please let me know why order of extracted information is not in order with respect to channel ids its getting changes after each execution,neutral,"['anybody', 'let', 'thanks', 'information', 'extracted', 'getting', 'please', 'order', 'sharing', 'execution', 'content', 'informative', 'know', 'changes', 'respect', 'channel', 'ids']",17,0.8779,0.291,0.0,0.709
26,26,savyhash1855,2024-02-01,2024-02-01,0,0.77334857,i have never seen such a detailed my video..great,pos,"['great', 'detailed', 'video', 'seen', 'never']",5,0.0,0.0,0.0,1.0
27,27,chetankembhavi4810,2024-01-31,2024-01-31,0,-0.5561614,no module named googleapiclient error solve this error sir,neg,"['module', 'sir', 'solve', 'named', 'error', 'googleapiclient']",6,-0.7003,0.125,0.528,0.347
28,28,chetankembhavi4810,2024-01-27,2024-01-27,0,0.41330877,mini project i will take sir,neutral,"['sir', 'mini', 'take', 'project']",4,0.0,0.0,0.0,1.0
29,29,dodgewagen,2024-01-20,2024-01-20,0,0.78226507,thank you,pos,['thank'],1,0.3612,0.714,0.0,0.286
30,30,user-qm2bq7vz2n,2024-01-18,2024-01-18,0,-0.19142154,lot i think they patched the channeled thing,neutral,"['patched', 'lot', 'thing', 'think', 'channeled']",5,0.0,0.0,0.0,1.0
31,31,bobbymcclane2639,2024-01-10,2024-01-10,0,0.96297973,your coding skills are very good,pos,"['good', 'coding', 'skills']",3,0.4927,0.39,0.0,0.61
32,32,clementinecritique,2024-01-03,2024-01-03,0,0.57676613,"hi thoufiq, thank you for sharing the steps in details i followed it the whole day to learn i am almost a total beginner your video is very engaging and super useful you beat many professors in terms of efficiency and clarity was only having difficulty with scraping the total amount of videos with the original lines i did not know why and my troubleshooting didn't work until trying chatgpt. when i used the written lines i got 39 results instead of all the 239. it got resolved with the following lines i put it here for other users who may run into the same problem.def get_video_details: all_video_stats for i in range 50): request youtube.videos.list ) response request.execute check if there are no videos in the response if items not in response continue for video in response video_stats dick all_video_stats.append return all_video_stats",pos,"['lines', 'almost', 'range', 'sharing', 'difficulty', 'items', 'thank', 'many', 'amount', 'followed', 'whole', 'video', 'steps', 'thoufiq', 'beginner', 'terms', 'may', 'professors', 'request', 'got', '39', 'day', 'used', 'beat', 'super', 'learn', 'trying', 'following', 'put', 'response', 'scraping', 'clarity', 'useful', 'troubleshooting', 'hi', 'resolved', 'chatgpt', 'users', 'continue', 'work', 'details', 'videos', 'return', 'efficiency', 'dick', 'engaging', 'total', 'results', 'run', 'instead', '50', 'know', 'check', 'original', 'written']",55,0.9438,0.169,0.051,0.78
33,33,fortunusgames,2023-12-10,2023-12-10,0,0.9710818,"hi thoufiq, this is a very impressive tutorial i followed this and managed to create my own visualizations for my master of arts project which analyzes several political youtubers' video output very helpful",pos,"['hi', 'create', 'analyzes', 'managed', 'project', 'arts', 'youtubers', 'output', 'visualizations', 'several', 'helpful', 'followed', 'master', 'thoufiq', 'video', 'political', 'tutorial', 'impressive']",18,0.831,0.239,0.0,0.761
34,34,mohamedabdo-xg6tw,2023-12-09,2023-12-09,0,0.7916056,"thank you thoufiq for the great tutorial watching in de 2023, i guess the ape removed the dislaikecount in statistics and replaced it with favoritecount. just a heads-up. i don't know why they did that dislikes are good metrics to track specially if we are working with business account on youtube. thank you again",pos,"['ape', '2023', 'thank', 'thoufiq', 'tutorial', 'replaced', 'favoritecount', 'dislaikecount', 'dislikes', 'guess', 'youtube', 'great', 'watching', 'account', 'good', 'metrics', 'business', 'specially', 'removed', 'de', 'working', 'know', 'track', 'statistics']",24,0.8519,0.198,0.044,0.758
35,35,yogeshindulkar320,2023-12-08,2023-12-08,0,-0.6936017,my function is stuck running at row 16 i had restarted it still it is taking pause at row 16 get_video_ids at this point can u help me why this is happening ?,neg,"['still', '16', 'row', 'restarted', 'help', 'running', 'pause', 'stuck', 'u', 'point', 'function', 'taking', 'happening']",13,0.1779,0.083,0.061,0.856
36,36,324jasminechristyleo6,2023-11-29,2023-11-29,0,-0.68983805,his broom my googly ape python client is not installedcan you help me,neg,"['ape', 'python', 'broom', 'googly', 'client', 'installedcan', 'help']",7,-0.3089,0.0,0.158,0.842
37,37,Mrroy08657,2023-11-24,2023-11-24,0,0.0027873442,in video details data how to fetch all the ' video id ' from response object at the same time with others details ? ' video id ' can act as the primary key here in analysis on all dos,neutral,"['analysis', 'others', 'object', 'act', 'details', 'time', 'key', 'id', 'primary', 'response', 'video', 'dos', 'data', 'fetch']",14,0.0,0.0,0.0,1.0
38,38,user-fr9fg3rf2h,2023-11-22,2023-11-22,0,-0.42469645,where is comments scraped in the above code????????????????????????????????????????????,neutral,"['comments', 'code', 'scraped']",3,0.0,0.0,0.0,1.0
39,39,1111ferfer,2023-11-20,2023-11-20,0,0.014965769,what can we do to search statistics for top 40 videos sorted by relevance to region,neutral,"['top', 'videos', 'search', '40', 'sorted', 'relevance', 'region', 'statistics']",8,0.2023,0.107,0.0,0.893
40,40,user-hb3cm6mb5u,2023-11-06,2023-11-06,0,0.8071661,brow this is an awesome project and i have learned very much but pro when i open the curl of your blog then it show me an error in the rule so please tell me how can i download your blogs regarding this project,pos,"['much', 'project', 'brow', 'download', 'please', 'awesome', 'error', 'tell', 'learned', 'rule', 'open', 'pro', 'blog', 'curl', 'regarding', 'show', 'blogs']",17,0.4564,0.136,0.074,0.79
41,41,princegirl5640,2023-10-28,2023-10-28,0,0.08342495,after completing this project how to format this in resume project session,neutral,"['session', 'resume', 'project', 'completing', 'format']",5,0.0,0.0,0.0,1.0
42,42,bhagyasrisheraboina2019,2023-10-23,2023-10-23,0,-0.64452064,showing invalid packages specifications in anaconda prompt,neg,"['packages', 'prompt', 'invalid', 'specifications', 'showing', 'anaconda']",6,0.0,0.0,0.0,1.0
43,43,andersonfernandes6998,2023-10-10,2023-10-10,0,0.9517871,thank you very much for this tutorial i am starting my studies in data analytical and this video has helped me a lot in understanding tell after seeing the results i had a question is it possible to achieve a similar result by extracting comments from each video,pos,"['result', 'thank', 'tell', 'studies', 'possible', 'video', 'starting', 'tutorial', 'much', 'question', 'helped', 'similar', 'seeing', 'analytical', 'data', 'comments', 'results', 'lot', 'understanding', 'achieve', 'extracting']",21,0.3612,0.056,0.0,0.944
44,44,amazingpatrick4659,2023-10-09,2023-10-09,1,-0.7617572,his it seems the google-api-python-client is not available right now,neg,"['seems', 'right', 'available']",3,0.0,0.0,0.0,1.0
45,45,user-oh9zv4st5t,2023-10-09,2023-10-09,0,0.90262586,i think your tutorials are amazing i the best data analytic tutorials i i really like and learn a lot from this tutorial but i want to work on this code too the link that you give is not working now can you update this link pleeassseee :(((((,pos,"['pleeassseee', 'link', 'tutorial', 'really', 'learn', 'update', 'analytic', 'amazing', 'code', 'work', 'best', 'tutorials', 'think', 'data', 'give', 'lot', 'working', 'want', 'like']",19,0.7466,0.18,0.0,0.82
46,46,wingdigitalmarketing,2023-10-04,2023-10-04,0,0.927423,that was wonderfully helpful thoufiq. i am a complete novice and while elements of the coding such as programs you used where to find them how to integrate are aspects i need to further study the process you took was clear and inciteful. i paid attention throughout and flatter myself that i saw a few of your return errors before you did now to study some more and see where this takes me thanks again avid,pos,"['avid', 'novice', 'attention', 'clear', 'study', 'saw', 'process', 'thoufiq', 'find', 'throughout', 'coding', 'used', 'inciteful', 'programs', 'took', 'integrate', 'return', 'see', 'complete', 'aspects', 'helpful', 'need', 'takes', 'thanks', 'wonderfully', 'elements', 'flatter', 'errors', 'paid']",29,0.9081,0.195,0.03,0.776
47,47,28petals,2023-09-18,2023-09-18,0,-0.5044454,can we get videos based on language like only english videos or only punish videos,neg,"['punish', 'language', 'english', 'get', 'based', 'videos', 'like']",7,-0.2263,0.132,0.18,0.688
48,48,038Dude,2023-09-17,2023-09-17,0,-0.70637125,"man ism almost desperate at this point there's this ape called tube and it's for windows devices it's a third party it ape and it's frigging awesome but the problem is that the de is ask just vanished without any notice i am quite teach illiterate but have managed to create my own ape key to keep the ape going lately it wont let me use the embedded player whatever that means making me use the official it web player which in turn won't play anything above 360p, and all of the cool functions of tube cant be used either i just wish i knew how to fix this.....",neg,"['ism', 'ape', 'desperate', 'almost', 'wish', 'man', 'illiterate', 'frigging', 'quite', 'wont', 'going', 'windows', 'used', 'key', 'awesome', 'embedded', 'devices', 'keep', 'knew', 'official', 'tube', 'wo', 'create', 'let', 'player', 'turn', 'means', 'notice', 'teach', 'party', 'ask', 'making', 'use', 'functions', 'fix', '360p', 'anything', 'problem', 'managed', 'lately', 'web', 'de', 'called', 'either', 'third', 'cant', 'point', 'play', 'whatever', 'cool', 'vanished', 'without']",52,0.726,0.116,0.064,0.82
49,49,prajwalmeshram32,2023-09-16,2023-09-16,3,-0.27501303,"i tried extracting video details from channels who have had their likes dislikes sometimes even commentcount disables so i had to write additional check for thatdef get_video_details: all_video_stats for i in range,50): requestyoutube.videos.list) responserequest.execute for video in response video_statsdict video_statsvideo, video_statsvideo, expected_check for item in expected_check: if item in video video_statsvideo else video_statsnone all_video_stats.append return all_video_stats",neutral,"['video', 'channels', 'even', 'dislikes', 'likes', 'item', 'additional', 'response', 'tried', 'details', 'disables', 'return', 'write', 'commentcount', 'thatdef', 'else', 'check', 'extracting', 'sometimes']",19,0.0258,0.05,0.048,0.903
50,50,TheEmpoweredMind27,2023-09-16,2023-09-16,1,-0.4993416,"when i execute this code:def get_video_details: all_video_stats for i in range 50): request youtube.videos.list ) response request.execute for video in response video_stats all_video_stats.append return all_video_statsi get this error:typeerror traceback input in , in cell line 1 ---- 1 get_video_details input in , in get_video_details 2 all_video_stats 4 for i in range 50): 5 request youtube.videos.list 8 ) 9 response request.execute 11 for video in response typeerror: sequence item i expected star instance ellipsis found",neutral,"['ellipsis', 'range', '5', '8', 'video', '2', 'cell', 'request', 'star', 'item', 'found', 'line', 'response', '9', 'code', 'input', 'get', 'def', 'return', 'expected', 'typeerror', 'execute', '1', '4', 'error', 'instance', '50', '11', 'sequence', 'traceback']",30,0.0,0.0,0.0,1.0
51,51,Magi_son,2023-09-15,2023-09-15,0,-0.081692435,how to show video id,neutral,"['id', 'video', 'show']",3,0.0,0.0,0.0,1.0
52,52,lalithkishorep2618,2023-09-08,2023-09-08,0,-0.61987484,hi sir i have doubt on how we can take subscribe count,neg,"['hi', 'sir', 'count', 'subscribe', 'take', 'doubt']",6,-0.3612,0.0,0.2,0.8
53,53,chiragbhawsar4544,2023-09-06,2023-09-06,0,-0.37783727,how we scrapped comment with this videos,neutral,"['comment', 'scrapped', 'videos']",3,0.0,0.0,0.0,1.0
54,54,kiruthickagp,2023-09-05,2023-09-05,0,0.8240938,thanks a lot techtfq. i was struggling a lot to do the initial steps of this project . please do lot of videos like this !!!!!!!,pos,"['initial', 'thanks', 'project', 'please', 'lot', 'videos', 'like', 'struggling', 'steps', 'techtfq']",10,0.7243,0.299,0.094,0.607
55,55,harish1838,2023-09-03,2023-09-03,1,-0.53727365,hey people i have an issue installing environment can someone help me fixity,neg,"['issue', 'hey', 'help', 'installing', 'fixity', 'someone', 'people', 'environment']",8,0.4019,0.197,0.0,0.803
56,56,muhammaddanialtanoli,2023-08-27,2023-08-27,0,0.9835617,nicely explained each and every detail thank you so much,pos,"['every', 'much', 'detail', 'nicely', 'thank', 'explained']",6,0.6597,0.403,0.0,0.597
57,57,thetruth4461,2023-08-07,2023-08-07,2,-0.42030308,"for those of you who are seeing this project in 2023, in the function to get video ids remove the dislike code as now couture ape does not give information on dislikes",neutral,"['ape', 'code', 'couture', 'project', '2023', 'information', 'dislikes', 'get', 'give', 'remove', 'seeing', 'function', 'video', 'dislike', 'ids']",15,-0.6486,0.0,0.15,0.85
58,58,kowsergazi,2023-08-04,2023-08-04,0,0.9675798,great video looking for more like this,pos,"['great', 'like', 'video', 'looking']",4,0.7841,0.58,0.0,0.42
59,59,samueljudephilips137,2023-08-01,2023-08-01,0,-0.76237005,"hey thoufiq , ism stuck at 16:45 , the part where i executed the code..........i don't see any output or errors , it just takes me to another line or box to type code..............also the juster notebook didn't open in my created environment but i anyways continued in the python ipykernel. please help me",neg,"['ism', 'continued', 'hey', 'executed', 'output', 'part', 'notebook', 'thoufiq', 'another', 'line', 'help', 'open', 'created', 'code', 'anyways', 'box', 'type', 'juster', 'see', 'also', 'environment', 'python', 'ipykernel', 'takes', 'please', 'errors', 'stuck']",27,0.7003,0.145,0.058,0.797
60,60,kamalikamukherji6482,2023-07-22,2023-07-22,0,-0.25047603,how do u manage to learn work show so much sir seems you got dark circles how do u work so hard plus suggest,neutral,"['circles', 'much', 'got', 'plus', 'work', 'learn', 'sir', 'seems', 'u', 'manage', 'suggest', 'dark', 'hard', 'show']",14,-0.2183,0.0,0.082,0.918
61,61,nikethdonthula2123,2023-07-14,2023-07-14,1,0.19856319,can i put this project in my resume i,neutral,"['put', 'resume', 'project']",3,0.0,0.0,0.0,1.0
62,62,soumilyade1057,2023-07-14,2023-07-14,1,0.98072106,30:52 well now you have 215k subscribers ad congrats on that and thanks for the video....!,pos,"['well', 'thanks', 'congrats', 'ad', 'video', 'subscribers', '215k']",7,0.8268,0.401,0.0,0.599
63,63,sethpai,2023-06-30,2023-06-30,0,0.9420361,brilliant tutorial appreciated the pace and details with this tutorial i can focus my time on exploring couture data and not worrying about how to get it,pos,"['focus', 'couture', 'exploring', 'brilliant', 'details', 'time', 'appreciated', 'worrying', 'get', 'pace', 'data', 'tutorial']",12,0.8456,0.284,0.0,0.716
64,64,edwardboyo9746,2023-06-29,2023-06-29,0,0.14511788,i was going through the video that has to do with the couture apian then i want to take a different way i would like to access the number of videos for each of the youtubers and also their videos later on as i go on as you did as well,neutral,"['different', 'going', 'way', 'well', 'couture', 'number', 'go', 'youtubers', 'videos', 'want', 'like', 'take', 'video', 'would', 'later', 'apian', 'access', 'also']",18,0.6369,0.146,0.0,0.854
65,65,gopia5095,2023-06-25,2023-06-25,0,0.09628199,clear explanation,neutral,"['clear', 'explanation']",2,0.3818,0.722,0.0,0.278
66,66,SMajid--SMajid,2023-06-20,2023-06-20,5,0.051314306,"here's how to get channel id in 2023:1. go to the desired channel and right click on the channel page go to view page source's on the source page top left will have line wrap with a check box check that box press ctrl+f on your keyboard to open search table type '?channel_id', it will highlight channel id for you copy and use it",neutral,"['right', 'view', 'left', 'highlight', 'table', 'source', 'keyboard', 'id', 'line', 'search', 'open', 'go', 'wrap', 'click', 'get', 'box', 'type', 'use', 'channel', 'press', 'top', 'page', 'copy', 'check', 'desired']",25,0.6486,0.095,0.0,0.905
67,67,mohitnemade5320,2023-06-18,2023-06-18,0,0.9115451,project is very awesome for learn but only the thing while speaking take a breath & stop a bit and explain well continuously you are speaking it looks like someone is following you and feeling also sleepy while working on project,pos,"['feeling', 'take', 'looks', 'sleepy', 'breath', 'project', 'following', 'learn', 'awesome', 'thing', 'stop', 'someone', 'explain', 'well', 'speaking', 'also', 'bit', 'continuously', 'working', 'like']",20,0.7612,0.224,0.061,0.715
68,68,ruksharalam173,2023-06-12,2023-06-12,0,0.032004632,can we get the github rep for this code,neutral,"['rep', 'get', 'code', 'github']",4,0.0,0.0,0.0,1.0
69,69,machineUnlearner,2023-06-03,2023-06-03,2,-0.5950486,now the couture channel id cannot be extracted from the process you mentioned please let me know the alternate,neg,"['let', 'couture', 'mentioned', 'extracted', 'please', 'id', 'process', 'know', 'channel', 'alternate']",10,0.3182,0.113,0.0,0.887
70,70,d4lm0,2023-05-31,2023-05-31,1,-0.31060258,"to those who had problems installing google-api-python-client try thereto install this package run one of the following condo install c conda-forge google-api-python-client condo install c ""conda-forge/label/cf201901"" google-api-python-client condo install c ""conda-forge/label/cf202003"" google-api-python-client condo install c ""conda-forge/label/gcc7"" google-api-python-client",neutral,"['thereto', 'following', 'package', 'run', 'c', 'installing', 'problems', 'try', 'install', 'condo', 'one']",11,-0.4019,0.0,0.078,0.922
71,71,beforeyourimmigrants8471,2023-05-28,2023-05-28,0,-0.15807839,that accent is too distracting you should do some mealtime voice cloning to sound like an america it'll be awesome if it was implemented at the university level 2 so we can understand what these professors are saying,neutral,"['understand', 'voice', 'professors', 'america', 'saying', 'mealtime', 'distracting', 'awesome', 'implemented', 'accent', 'like', 'cloning', 'sound', 'university', 'level', '2']",16,0.6597,0.154,0.051,0.794
72,72,mhapich,2023-05-21,2023-05-21,2,0.92661446,this is the first video that have watched on scraping anything that i was able to follow from beginning to end understand and be able to apply to my own channels and project...without running into problems that couldn't be easily fixed i could fix my own mistakes because you explained each step so thoroughly thank you,pos,"['follow', 'step', 'first', 'thank', 'explained', 'video', 'problems', 'channels', 'project', 'running', 'scraping', 'able', 'understand', 'beginning', 'mistakes', 'thoroughly', 'could', 'apply', 'fix', 'end', 'anything', 'easily', 'fixed', 'watched', 'without']",25,-0.4879,0.051,0.12,0.829
