Unnamed: 0,id,author,published_at,updated_at,like_count,sentiment_score,text,labeled_status,unique_tokens,token_count,compound_score,positive_score,negative_score,neutral_score
73,73,hoekbrwr,2023-05-19,2023-05-19,0,0.82657075,i am happy i struggled over this i was goggling for a googly apes script and ended in python it is a very clear explanation and i am so happy about your english pronunciation lot of your country men have a strong accent i get very very tired of so i give up or miss too much so i subscribed to your channel,pos,"['clear', 'googly', 'struggled', 'pronunciation', 'subscribed', 'much', 'country', 'script', 'tired', 'miss', 'happy', 'get', 'channel', 'python', 'apes', 'english', 'men', 'give', 'explanation', 'lot', 'accent', 'ended', 'goggling', 'strong']",24,0.7976,0.203,0.111,0.686
74,74,praveenlifemaker,2023-05-18,2023-05-18,1,-0.33045033,in charm ism unable to get the return response the code is executed perfectly but with no output in the console what to do,neutral,"['ism', 'code', 'charm', 'unable', 'console', 'get', 'executed', 'output', 'return', 'response', 'perfectly']",11,0.1655,0.158,0.099,0.743
75,75,user-zd4wq8ue4p,2023-05-17,2023-05-17,0,-0.6542811,his techtfq how to get different couture channel curl link please put related videos..here i cant understand that only reason...,neg,"['different', 'link', 'understand', 'couture', 'channel', 'put', 'please', 'get', 'videos', 'cant', 'techtfq', 'related', 'curl', 'reason']",14,0.3182,0.113,0.0,0.887
76,76,jareshiahsamuel4207,2023-05-09,2023-05-09,0,-0.41995466,ism getting key error statistics i can some one help me out to solve the error,neutral,"['ism', 'getting', 'solve', 'key', 'error', 'help', 'statistics', 'one']",8,-0.2263,0.215,0.258,0.526
77,77,saimahmad1445,2023-05-01,2023-05-01,0,0.83791286,it was the best video on this topic... i have a question can you please tell me how to use filter on tags while retrieving videos data,pos,"['topic', 'filter', 'best', 'please', 'tell', 'videos', 'tags', 'video', 'use', 'question', 'data', 'retrieving']",12,0.7579,0.22,0.0,0.78
78,78,raghavdadhich9774,2023-04-26,2023-04-26,0,-0.79618895,where is the code sheet i am not able to find it,neg,"['able', 'find', 'code', 'sheet']",4,0.0,0.0,0.0,1.0
79,79,Sumfinfunny777,2023-04-21,2023-04-21,2,-0.44847628,"condo install google-api-python-client"" did not workbut""conda install c conda-forge google-api-python-client"" worked",neutral,"['workbut', 'worked', 'c', 'conda', 'install', 'condo']",6,0.0,0.0,0.0,1.0
80,80,VictoireRey-pr7qh,2023-04-18,2023-04-18,2,-0.78641474,"hello ism trying to run your code to get video details from a list of video_ids but i have a sol error when running video_detailsget_video_details and don't know how to fix it... error is the following : ""sslcertverificationerror: certificate verify failed self signed certificate in certificate chain "" do you know how i can fix this thanksssss",neg,"['ism', 'video', 'sslcertverificationerror', 'trying', 'following', 'self', 'list', 'running', 'thanksssss', 'sol', 'code', 'details', 'get', 'certificate', 'verify', 'fix', 'hello', 'run', 'error', 'know', 'signed', 'failed', 'chain']",23,-0.9109,0.0,0.194,0.806
81,81,annarocha9769,2023-04-07,2023-04-07,0,0.98893476,orgy this is awesome thanks a lot,pos,"['awesome', 'thanks', 'orgy', 'lot']",4,0.7906,0.636,0.0,0.364
82,82,AlexandreDias18,2023-04-07,2023-04-07,11,0.9875448,wow as a fellow data scientists i am truly amazed by the incredible work you've done your expertise in data analysis and modeling is truly inspiring your ability to harness the power of data to uncover insights and make informed decisions is truly invaluable your work has helped businesses optimize their operations improve customer experiences and drive innovation thank you for your hard work and dedication in making the world a better place through data-driven insights keep up the amazing work,pos,"['analysis', 'operations', 'amazed', 'better', 'power', 'invaluable', 'informed', 'thank', 'hard', 'innovation', 'done', 'scientists', 'keep', 'dedication', 'amazing', 'uncover', 'inspiring', 'make', 'helped', 'customer', 'work', 'improve', 'harness', 'decisions', 'place', 'making', 'data', 'fellow', 'world', 'expertise', 'drive', 'insights', 'optimize', 'businesses', 'wow', 'ability', 'truly', 'incredible', 'experiences', 'modeling']",40,0.9885,0.372,0.013,0.615
83,83,sabasareen1436,2023-03-28,2023-03-28,0,-0.11084376,how to get only comments of the video,neutral,"['comments', 'get', 'video']",3,0.0,0.0,0.0,1.0
84,84,sruthysunil1423,2023-03-20,2023-03-20,0,-0.6005214,"hi sir i would to like to ask you about a doubt regarding the channel ids i am not able to get the channel id from the above mentioned method , even i have tried to select a video from the channel and checked the curl now it all are customized and i wasn't able to get the channel id is there any other way to get the channel ids",neg,"['mentioned', 'method', 'select', 'video', 'doubt', 'regarding', 'even', 'customized', 'sir', 'id', 'curl', 'hi', 'able', 'get', 'ask', 'channel', 'way', 'checked', 'like', 'tried', 'would', 'ids']",22,0.0,0.038,0.038,0.924
85,85,aasimgandhi69,2023-03-17,2023-03-17,0,-0.785069,i have issue on get_video_details function is returningthis much output only i don't know why my code is perfect but still it is note returning videos list,neg,"['still', 'returning', 'much', 'issue', 'code', 'output', 'videos', 'list', 'perfect', 'know', 'function', 'note', 'returningthis']",13,0.3291,0.089,0.0,0.911
86,86,Empeiro,2023-03-07,2023-03-07,0,0.98669875,brother what a nice video thanks for the time and sharing,pos,"['thanks', 'time', 'nice', 'sharing', 'video', 'brother']",6,0.8176,0.548,0.0,0.452
87,87,denisaroxana4006,2023-03-03,2023-03-03,0,-0.023602016,can you get video data from videos posted in a certain week or a specific time frame,neutral,"['specific', 'time', 'get', 'week', 'videos', 'certain', 'posted', 'frame', 'video', 'data']",10,0.2732,0.13,0.0,0.87
88,88,manassr7840,2023-02-07,2023-02-07,0,0.20467591,is it possible to use the extracted data and implement an my model if so which would be the best suitable model,neutral,"['extracted', 'best', 'model', 'possible', 'suitable', 'implement', 'use', 'would', 'data']",9,0.6369,0.167,0.0,0.833
89,89,farsanarahman5370,2023-01-31,2023-01-31,0,-0.6350956,"i don't get channel id , any one please help on this",neg,"['please', 'get', 'id', 'help', 'channel', 'one']",6,0.6124,0.385,0.0,0.615
90,90,hassansemlali7450,2023-01-31,2023-01-31,0,0.97973186,nice content brother you help me a lot i really appreciate your efforts,pos,"['really', 'nice', 'content', 'lot', 'help', 'appreciate', 'brother', 'efforts']",8,0.8173,0.515,0.0,0.485
91,91,pranayjain._,2022-12-31,2022-12-31,0,0.8604164,thanks a lot,pos,"['thanks', 'lot']",2,0.4404,0.744,0.0,0.256
92,92,ronaldchrishton7969,2022-12-29,2022-12-29,0,0.8002871,the its useful for me,pos,['useful'],1,0.4404,0.42,0.0,0.58
93,93,ShrutiKhandelwal007,2022-12-29,2022-12-29,1,-0.25605345,can we also extract random channel names/ids using python code for the data analysis to know who's at the top in any field we have to search the channel name to find its id as of now i had to search googly for the top subscribers and then analyzed it can't we just randomly sample this whole couture dataset to get the channel and do the analysis,neutral,"['analysis', 'sample', 'couture', 'googly', 'field', 'ca', 'name', 'whole', 'subscribers', 'extract', 'find', 'id', 'search', 'code', 'randomly', 'get', 'channel', 'data', 'also', 'analyzed', 'python', 'top', 'random', 'using', 'know', 'dataset']",26,0.3818,0.053,0.0,0.947
94,94,jeeyuuni,2022-12-07,2022-12-07,2,0.9899368,thank you so much for this ! it was super easy to follow along you are a great teacher,pos,"['much', 'follow', 'super', 'thank', 'great', 'along', 'teacher', 'easy']",8,0.9286,0.513,0.0,0.487
95,95,novigrad7490,2022-12-05,2022-12-05,1,-0.20587659,can someone tell me how to scrape the duration of the video,neutral,"['scrape', 'tell', 'video', 'duration', 'someone']",5,0.0,0.0,0.0,1.0
96,96,jossyr6662,2022-12-04,2022-12-04,0,-0.3326886,can't we use pycharm?,neutral,"['use', 'ca', 'pycharm']",3,0.0,0.0,0.0,1.0
97,97,AK-Star007,2022-11-19,2022-11-19,2,0.29436457,this was exactly what i was looking for to the point explanation than,neutral,"['looking', 'exactly', 'point', 'explanation']",4,0.0,0.0,0.0,1.0
98,98,apusarkar864,2022-11-19,2022-11-19,0,-0.81206626,"i run the command ""get_channel_stats"" but i not getting proper result i get this output",neg,"['result', 'proper', 'getting', 'run', 'get', 'output', 'command']",7,0.0,0.0,0.0,1.0
99,99,apusarkar864,2022-11-19,2022-11-19,0,-0.62101436,"hi thoufiq, i trying to get channel id but its not showing instead of custom you told in your video how to get the channel id but its not working in that way so can you tell me any hack that how to get channeled from couture custom url?thanks",neg,"['couture', 'custom', 'told', 'tell', 'hack', 'video', 'thoufiq', 'channeled', 'trying', 'id', 'showing', 'hi', 'get', 'channel', 'way', 'thanks', 'instead', 'working', 'url']",19,0.0,0.0,0.0,1.0
100,100,zechariaparas9885,2022-11-17,2022-11-17,0,0.98340493,awesome video subscribed because of this keep up the good work godsend,pos,"['good', 'work', 'awesome', 'keep', 'video', 'godsend', 'subscribed']",7,0.8957,0.545,0.0,0.455
101,101,rajathratnakaran7893,2022-11-11,2022-11-11,0,-0.7580568,ism getting this error keyerror: 'commentcount'. please help,neg,"['ism', 'getting', 'please', 'error', 'help', 'keyerror']",6,0.2204,0.381,0.238,0.381
102,102,jarosawszyc8287,2022-11-05,2022-11-05,0,0.9602355,absolutely amazing video,pos,"['absolutely', 'amazing', 'video']",3,0.624,0.672,0.0,0.328
103,103,HarperWolf,2022-11-02,2022-11-02,0,-0.82811856,his i am about 22:00 minutes into the tutorial and i am getting an error that says redefining name ''youtube' from outer scope i and i am getting syntax errors do you know why this is or how to resolve the issue,neg,"['scope', 'issue', 'minutes', 'getting', 'youtube', 'error', 'errors', 'syntax', 'know', 'name', 'redefining', 'says', 'resolve', 'tutorial', 'outer']",15,-0.3612,0.061,0.119,0.82
104,104,kalheer,2022-11-02,2022-11-02,0,0.96224385,love this easy to follow,pos,"['follow', 'easy', 'love']",3,0.7964,0.703,0.0,0.297
105,105,ExcelNWithInisa,2022-10-29,2022-10-29,0,0.98041624,ism only 25 minutes in and have learned sooooooooo much already thank you i,pos,"['ism', '25', 'much', 'minutes', 'thank', 'learned', 'sooooooooo', 'already']",8,0.3612,0.172,0.0,0.828
106,106,digdra,2022-10-25,2022-10-25,2,0.949431,best tutorial about getting couture data i found here your code is cleaner than the one proposed in other tutorials thank you,pos,"['couture', 'code', 'best', 'getting', 'tutorials', 'found', 'proposed', 'thank', 'cleaner', 'data', 'tutorial', 'one']",12,0.8126,0.318,0.0,0.682
107,107,roshangupta7844,2022-10-24,2022-10-24,0,-0.084799185,i wanted to ask if it is possible to get video of a channel from specific country like if i wanted video of creator from india or china only then how can i do that what should be my approach,neutral,"['approach', 'specific', 'china', 'get', 'wanted', 'country', 'creator', 'like', 'possible', 'video', 'ask', 'channel', 'india']",13,0.3612,0.067,0.0,0.933
108,108,Wexler111,2022-10-18,2022-10-18,0,0.97916263,great tutorial thanks a lot,pos,"['great', 'lot', 'tutorial', 'thanks']",4,0.7906,0.778,0.0,0.222
109,109,martinbenum5653,2022-10-15,2022-10-15,0,-0.47212288,hi thoufiq. i am trying to follow your process on this and have hit a snag trying to get a channeled for any one using your hack of double clicking as found around 12:30 of your video seems couture may have locked that functionality,neutral,"['clicking', 'follow', 'couture', 'process', 'hack', 'video', 'thoufiq', 'channeled', 'may', 'trying', 'found', 'snag', 'functionality', 'around', 'one', 'hi', 'get', 'hit', 'locked', 'double', 'seems', 'using']",22,0.0,0.0,0.0,1.0
110,110,kamalgopalsingh244,2022-10-14,2022-10-14,0,0.041720152,hie where to learn myself for free from basic to advanced for data analyst and how to make project on mysql?please guide,neutral,"['project', 'learn', 'please', 'free', 'basic', 'advanced', 'analyst', 'hie', 'mysql', 'guide', 'data', 'make']",12,0.6486,0.209,0.0,0.791
111,111,YoussefMrabetYMF68,2022-10-09,2022-10-09,0,0.3690464,"hi thoufiq, i would like to follow your instructions but i didn't know how to do the part "" i already imported the build ? any help would be appreciated thank you !!!",neutral,"['hi', 'follow', 'appreciated', 'imported', 'part', 'help', 'thank', 'like', 'know', 'thoufiq', 'would', 'build', 'already', 'instructions']",14,0.931,0.366,0.0,0.634
112,112,pzuazu8636,2022-10-04,2022-10-04,0,0.9892199,wow i love how you bring it all together thank you again,pos,"['thank', 'wow', 'love', 'bring', 'together']",5,0.8885,0.568,0.0,0.432
113,113,ferdinandosomma8885,2022-10-01,2022-10-01,0,0.608286,it was very useful and easy to understand just subscribed anyway it'd like to ask you a question i have to do a project for my master course using couture paid but i need a large amount of data basically a lot of channel id of my country . is there any method or code that i can use in order to fetch all the ids because to me it's impossible to insert them manually one by one appreciate any help,pos,"['couture', 'large', 'method', 'amount', 'course', 'easy', 'subscribed', 'project', 'id', 'country', 'help', 'ids', 'question', 'impossible', 'useful', 'fetch', 'understand', 'one', 'code', 'appreciate', 'ask', 'use', 'channel', 'data', 'need', 'order', 'insert', 'lot', 'like', 'using', 'manually', 'paid', 'basically', 'master', 'anyway']",35,0.9007,0.161,0.0,0.839
114,114,saikiran-yz8uv,2022-09-29,2022-09-29,1,-0.7709872,"hi thoufiq, googleapiclient.http.httprequest at 0x1f1d108fb80this is what i getting when i trying to return the response and i unable to get the output to paste and see in son validatorso can u plus tell me what is the problem and issue with this",neg,"['unable', 'output', 'paste', 'u', 'tell', 'son', 'thoufiq', 'plus', 'trying', 'response', '0x1f1d108fb80this', 'hi', 'getting', 'get', 'return', 'see', 'issue', 'problem', 'validatorso']",19,-0.4019,0.0,0.066,0.934
115,115,gastonalvarez3386,2022-09-07,2022-09-07,0,0.75645286,his congrats for the tutorial is really clearly explained i have a question what if i want to extract the comments from every video of a given playlets of a channel how can i do that thank you,pos,"['extract', 'comments', 'every', 'congrats', 'really', 'playlets', 'given', 'thank', 'explained', 'want', 'clearly', 'video', 'channel', 'question', 'tutorial']",15,0.8479,0.267,0.0,0.733
116,116,arpittrivedi6636,2022-09-06,2022-09-06,1,0.46904314,super duper boss,neutral,"['super', 'duper', 'boss']",3,0.5994,0.661,0.0,0.339
117,117,785lucky,2022-09-04,2022-09-04,0,0.47272155,great video taufiq. i have one question i want to browse latest 50 videos from any you tube channel and extract data for same but how can i get link for latest 50 videos only,neutral,"['browse', 'extract', 'link', 'taufiq', 'get', '50', 'videos', 'great', 'want', 'latest', 'video', 'channel', 'question', 'data', 'one', 'tube']",16,0.4019,0.11,0.0,0.89
118,118,manasasm5061,2022-08-28,2022-08-28,1,0.78226507,thank you,pos,['thank'],1,0.3612,0.714,0.0,0.286
119,119,nandhu7039,2022-08-27,2022-08-27,0,-0.10595128,how to use random channel id,neutral,"['use', 'channel', 'random', 'id']",4,0.0,0.0,0.0,1.0
120,120,urvindarkaur0278,2022-08-22,2022-08-22,11,0.5713047,"i haven't found anything better on couture than your videos for data analysis only request i have is for you to make as many projects as you can from easiest to most difficult projects so that we can be thorough in this field even if i have to pay for it it'd be more than happy but , please don't stop here especially for projects...learning languages is slightly different than when we have to put together all of the learned tings in the project",pos,"['analysis', 'slightly', 'couture', 'better', 'field', 'many', 'pay', 'request', 'languages', 'even', 'project', 'put', 'found', 'stop', 'together', 'difficult', 'make', 'different', 'learning', 'happy', 'thorough', 'easiest', 'videos', 'data', 'tings', 'anything', 'projects', 'please', 'learned', 'especially']",30,0.707,0.111,0.055,0.835
121,121,animespot1448,2022-08-21,2022-08-21,0,0.9641906,great videos sir its very helpful!sorry for my bad english but i want to ask you about group in your videos around 1:03:10how can i show the number of uploaded videos per month in ordered years thank you in advanced,pos,"['years', 'thank', 'group', 'per', 'sir', 'bad', 'great', 'month', 'around', 'uploaded', 'show', 'number', 'sorry', 'videos', 'ask', 'helpful', 'english', 'want', 'advanced', 'ordered']",20,0.8043,0.251,0.049,0.7
122,122,toshifchhipa8938,2022-08-21,2022-08-21,0,-0.71301556,"getting this error "" attributeerror: function object has no attribute list's for ""get_video_ids""",neg,"['object', 'getting', 'error', 'list', 'function', 'attribute', 'attributeerror']",7,-0.5994,0.0,0.329,0.671
123,123,RenatoCosta1,2022-08-18,2022-08-18,0,-0.22710723,great tutorial i was wondering how you click and paste all the outcome after running a cells so quickly the copy and paste to the son formatter is really useful but dragging the mouse to copy the output is a pain have noticed you don't do that and tried to find a way to do the same but did not succeed,neutral,"['output', 'paste', 'formatter', 'succeed', 'mouse', 'son', 'outcome', 'tutorial', 'find', 'really', 'cells', 'dragging', 'running', 'great', 'wondering', 'useful', 'noticed', 'click', 'way', 'quickly', 'copy', 'tried', 'pain']",23,-0.6423,0.071,0.12,0.809
124,124,skipa9906,2022-08-17,2022-08-17,1,-0.068024725,hi i new to data analysis and i wanna know the first part you are doing by scrapping or collected data is that data engineering,neutral,"['hi', 'analysis', 'engineering', 'part', 'first', 'collected', 'scrapping', 'know', 'data', 'new', 'wan', 'na']",12,0.0,0.0,0.0,1.0
125,125,gowriu9387,2022-08-16,2022-08-16,0,-0.3389332,"his could you please help me out i have just started out with python and some aspects seem too overwhelming am working through it but would be really helpful if you could help with this one error.in jupyter, i am getting an error that no module is found for googleapiclient.discovery",neutral,"['python', 'seem', 'module', 'really', 'getting', 'please', 'overwhelming', 'started', 'error', 'found', 'help', 'working', 'could', 'jupyter', 'would', 'one', 'aspects', 'helpful']",18,0.5913,0.188,0.107,0.705
126,126,shraddhashrivastava2480,2022-08-10,2022-08-10,0,-0.047743507,26:30 output me fun me channel ids ki list ani chaiye..par e hi channel ka name a ha he how to solve this issue,neutral,"['hi', 'ki', 'ani', 'issue', 'solve', 'par', 'fun', 'output', 'ha', 'list', 'chaiye', 'ka', 'name', 'channel', 'ids', 'e']",16,0.7579,0.283,0.0,0.717
127,127,brainstalk4577,2022-08-01,2022-08-01,1,0.97593504,very useful ! thank u,pos,"['u', 'useful', 'thank']",3,0.7402,0.862,0.0,0.138
128,128,webscrapingfreelancer76,2022-08-01,2022-08-01,0,0.07844415,we can also scrape using octoparse:-https://youtu.be/jqtvpderm4w,neutral,"['octoparse', 'scrape', 'also', 'using']",4,0.0,0.0,0.0,1.0
129,129,khanofficial5370,2022-07-31,2022-07-31,1,0.9589832,assalamualaikum toufiq it's really a best ever vedic which i look in couture for web scrapping,pos,"['look', 'couture', 'web', 'really', 'best', 'scrapping', 'toufiq', 'assalamualaikum', 'ever', 'vedic']",10,0.6697,0.257,0.0,0.743
130,130,haileeyuuno6233,2022-07-20,2022-07-20,1,-0.75951475,i am stuck i wanted to do a live view counter display but the viewpoint does not return live data is there anyway to do this please help,neg,"['view', 'display', 'please', 'wanted', 'anyway', 'help', 'stuck', 'return', 'viewpoint', 'live', 'data', 'counter']",12,0.757,0.229,0.049,0.722
131,131,angelleung02,2022-07-19,2022-07-19,0,0.008173279,may i plus ask...could you plus just send out your codes,neutral,"['plus', 'send', 'codes', 'could', 'ask', 'may']",6,0.0,0.0,0.0,1.0
132,132,solkarim2950,2022-07-16,2022-07-16,0,0.95123816,you are a great teacher,pos,"['great', 'teacher']",2,0.6249,0.577,0.0,0.423
133,133,MichaelThompson-pe1wi,2022-07-14,2022-07-14,1,0.8980472,i had to do a project like this for my internship you are a lifesaver,pos,"['like', 'lifesaver', 'project', 'internship']",4,0.743,0.387,0.0,0.613
134,134,samsonkiflom5954,2022-07-11,2022-07-11,0,0.8849001,thanks for creating this project i watched it like an action movie i and going to learn bit by bit again by creating the same project again,pos,"['going', 'thanks', 'project', 'action', 'learn', 'watched', 'bit', 'like', 'creating', 'movie']",10,0.8316,0.318,0.0,0.682
135,135,rajeshjakkawar3338,2022-07-06,2022-07-06,3,0.9243469,project is done...........thank you,pos,"['done', 'project', 'thank']",3,0.0,0.0,0.0,1.0
136,136,yichienchong7474,2022-07-05,2022-07-05,1,0.9891637,"thank you thoufiq, this is a great project",pos,"['great', 'project', 'thoufiq', 'thank']",4,0.765,0.569,0.0,0.431
137,137,othmanebelaidi4095,2022-07-03,2022-07-03,1,-0.10676866,his is it legal to scrap couture comments ? thanks,neutral,"['comments', 'couture', 'thanks', 'scrap', 'legal']",5,0.5267,0.386,0.0,0.614
138,138,Thilina_madushan,2022-07-02,2022-07-02,1,0.21498534,"hey most of useful tutorial,please say how to input couture channel ids in googly sheet",neutral,"['couture', 'googly', 'hey', 'please', 'input', 'say', 'ids', 'channel', 'tutorial', 'useful', 'sheet']",11,0.4902,0.185,0.0,0.815
139,139,rafaangelsbnmkrtmtuoplertu1240,2022-07-01,2022-07-01,0,0.14639345,we,neutral,[],0,0.0,0.0,0.0,1.0
140,140,camsmith4046,2022-06-30,2022-06-30,0,-0.51985127,"please sir,traceback : file ""c:\users\pc\desktop\using couture api\main.py"", line 54, in module get_channel_stats file ""c:\users\pc\desktop\using couture api\main.py"", line 46, in get_channel_stats data dick keyerror: 'items'how is it error items????",neg,"['module', 'couture', 'sir', 'please', 'c', 'error', 'file', 'line', '46', '54', 'items', 'keyerror', 'data', 'traceback', 'dick']",15,-0.6868,0.069,0.209,0.722
141,141,shubhampaliwal107,2022-06-26,2022-06-26,0,0.19320522,"hi taufiq, it's an excellent video ism getting ""attributeerror: 'str' object has no attribute request "" this error can you please help me out in this",neutral,"['hi', 'ism', 'request', 'object', 'taufiq', 'getting', 'please', 'error', 'help', 'video', 'excellent', 'attribute', 'attributeerror']",13,0.5228,0.256,0.157,0.588
142,142,FomyernSC2,2022-06-22,2022-06-22,0,0.50397617,"hi sir thank you for your tutorial it's very helpful for my research project.however, i have a problem when i tried to scrape video data from channels that have more 40,000 videos uploaded the scraper returns only 20,000 video databank suggestion to fix this issue",pos,"['thank', 'research', 'video', 'tutorial', 'channels', 'scrape', 'sir', 'uploaded', 'hi', 'scraper', 'returns', 'videos', 'databank', 'suggestion', 'fix', 'data', 'helpful', 'issue', 'problem', 'tried']",20,0.4391,0.118,0.057,0.825
143,143,tmh3929,2022-06-20,2022-06-20,1,0.98989725,thanks a lot techtfq! it's a great project indeed,pos,"['thanks', 'project', 'lot', 'great', 'indeed', 'techtfq']",6,0.807,0.593,0.0,0.407
144,144,praveennavin8342,2022-06-15,2022-06-15,0,0.8897386,great video....just a small doubt...can we present this into excel using cs module,pos,"['module', 'small', 'cs', 'great', 'using', 'video', 'doubt', 'excel', 'present']",9,0.7964,0.415,0.0,0.585
145,145,rox_official9407,2022-06-14,2022-06-14,0,0.012949295,only getting in the form of /c/nameofchannel,neutral,"['getting', 'form']",2,0.0,0.0,0.0,1.0
146,146,rox_official9407,2022-06-14,2022-06-14,0,-0.81759894,sir i am not able to find channel id using your method,neg,"['able', 'sir', 'method', 'id', 'using', 'channel', 'find']",7,0.0,0.0,0.0,1.0
147,147,KingofZamunda.,2022-06-13,2022-06-13,9,0.8090892,this is impressive and easy to follow however couture disabled the dislike count and this will affect the function to get video details,pos,"['couture', 'follow', 'details', 'get', 'count', 'disabled', 'however', 'affect', 'function', 'video', 'dislike', 'easy', 'impressive']",13,0.5574,0.215,0.09,0.694
148,148,shivamdubey4783,2022-06-11,2022-06-11,0,0.8962976,sir extremely great tutorial just one question how do we use this in dang and make our own videostreming website,pos,"['dang', 'sir', 'make', 'website', 'extremely', 'videostreming', 'great', 'use', 'question', 'tutorial', 'one']",11,0.659,0.188,0.0,0.812
149,149,rox_official9407,2022-06-06,2022-06-06,1,0.08133507,can you please share the github link of this project sir ?,neutral,"['project', 'sir', 'please', 'github', 'link', 'share']",6,0.5423,0.333,0.0,0.667
150,150,direct_football,2022-05-29,2022-05-29,0,0.7695286,great video one thing can you write this project in another editor pycharm?,pos,"['editor', 'project', 'great', 'thing', 'video', 'write', 'another', 'pycharm', 'one']",9,0.6249,0.255,0.0,0.745
151,151,fahnub,2022-05-25,2022-05-25,0,0.96627825,thank you for this,pos,['thank'],1,0.3612,0.455,0.0,0.545
152,152,fahnub,2022-05-25,2022-05-25,0,0.98171955,this is such a good practice project definitely going on my github.,pos,"['going', 'good', 'project', 'practice', 'github', 'definitely']",6,0.6808,0.384,0.0,0.616
153,153,dimanaeem3849,2022-05-20,2022-05-20,0,-0.88220406,"hi toufiq,i am a beginner and trying to create a virtual environment i am not able to succeed it shows space error.please help",neg,"['hi', 'able', 'create', 'space', 'trying', 'succeed', 'help', 'toufiq', 'beginner', 'virtual', 'environment', 'shows']",12,0.2896,0.196,0.108,0.696
154,154,allrounder9620,2022-05-18,2022-05-18,0,0.029884163,is members only videos also run,neutral,"['run', 'also', 'members', 'videos']",4,0.0,0.0,0.0,1.0
