Unnamed: 0,id,author,published_at,updated_at,like_count,sentiment_score,text,labeled_status,unique_tokens,token_count,compound_score,positive_score,negative_score,neutral_score
155,155,dfmayes,2022-05-12,2022-05-12,0,0.7195036,"very helpful video but at 11:33 you don't need to do this you can pass fromusername""techtfq"" in the request instead of id",pos,"['need', 'request', 'techtfq', 'instead', 'id', 'video', 'pass', 'fromusername', 'helpful']",9,0.2609,0.089,0.0,0.911
156,156,sandyputrautama9279,2022-05-06,2022-05-06,0,0.98202705,thank you very awesome tutorial,pos,"['awesome', 'tutorial', 'thank']",3,0.7841,0.697,0.0,0.303
157,157,aravindr8034,2022-05-05,2022-05-05,0,-0.035175636,sir i got modulenot found error can any help me to how love this,neutral,"['got', 'sir', 'modulenot', 'error', 'found', 'help', 'love']",7,0.6369,0.352,0.138,0.51
158,158,abonthego,2022-05-04,2022-05-04,0,-0.14205423,in marplot my axis is coming in decimal how to change it???,neutral,"['coming', 'decimal', 'axis', 'marplot', 'change']",5,0.0,0.0,0.0,1.0
159,159,sabaamanollahi5901,2022-04-18,2022-04-18,0,0.9856084,thank you thoufiq for this incredible video,pos,"['video', 'incredible', 'thoufiq', 'thank']",4,0.3612,0.294,0.0,0.706
160,160,manvithapalchuri6183,2022-04-12,2022-04-12,0,-0.75118023,hi i was trucked in between by this error.can i get help please''str' object has no attribute request,neg,"['hi', 'request', 'str', 'object', 'please', 'get', 'help', 'trucked', 'attribute']",9,0.128,0.143,0.116,0.741
161,161,shubhangikalambe3435,2022-04-11,2022-04-11,1,0.92460173,thanks for valuable information,pos,"['valuable', 'thanks', 'information']",3,0.7184,0.75,0.0,0.25
162,162,ExiledGypsy,2022-04-05,2022-04-05,1,0.76573884,i used to be a c and sol programmer but now i am retired want to download all my comments i have made over the years on different couture into a table or database i can store locally.you seem to have done exactly what i need to toucan i access all the necessary codes that i can just copy and paste will be most grateful,pos,"['years', 'seem', 'couture', 'retired', 'paste', 'exactly', 'database', 'table', 'made', 'used', 'done', 'c', 'codes', 'sol', 'grateful', 'access', 'different', 'store', 'necessary', 'need', 'programmer', 'comments', 'download', 'want', 'toucan', 'copy']",26,0.7086,0.1,0.0,0.9
163,163,ahmedhassan_saver,2022-03-27,2022-03-27,0,-0.051818375,brow is there any way with is to get channel id for channels that have customurl?,neutral,"['way', 'brow', 'get', 'customurl', 'id', 'channel', 'channels']",7,0.0,0.0,0.0,1.0
164,164,TamaJoki,2022-03-20,2022-03-20,0,0.21344914,his i already running ) and succeed but i don't now where that file can you answer that thank you,neutral,"['file', 'succeed', 'running', 'thank', 'already', 'answer']",6,0.6542,0.263,0.0,0.737
165,165,taqihussain5312,2022-03-19,2022-03-19,1,0.031668466,sir please update portfolio project for data analyst,neutral,"['project', 'portfolio', 'sir', 'please', 'update', 'analyst', 'data']",7,0.3182,0.247,0.0,0.753
166,166,vaibhavshah8384,2022-03-16,2022-03-16,2,0.8750714,"hi thoufiq, thanks for sharing this informative & interesting video i was wondering can we extract the actual comments with replies instead of comment count in this example thanks in advanced",pos,"['hi', 'comments', 'thanks', 'actual', 'comment', 'sharing', 'instead', 'count', 'interesting', 'replies', 'informative', 'advanced', 'video', 'thoufiq', 'wondering', 'example', 'extract']",17,0.9062,0.357,0.0,0.643
167,167,vamseesworld1035,2022-03-10,2022-03-10,1,0.96055746,thank you brother great tutorial good explanation it worked for me can you please make a video on how to extract all the comments likes and dislikes for each comment user name comment date it will help me a lot thank you for your great explanation,pos,"['thank', 'name', 'video', 'extract', 'tutorial', 'worked', 'dislikes', 'likes', 'help', 'great', 'user', 'make', 'good', 'date', 'brother', 'comments', 'comment', 'please', 'explanation', 'lot']",20,0.9648,0.388,0.044,0.568
168,168,monikabhandari9092,2022-03-04,2022-03-04,1,-0.014364541,"hi thoufiq, this is very useful video your content is really helpful for people like us who are freshers and want to pursue career in data analytical actually i am trying the same project but i am sucked at the juster notebook it doesn't show the virtual environment kernel that i have created for this project i tried to solve this problem by installing spy kernel and displaying kernel name but still notebook doesn't show the virtual environment kernel that i have created can you please help me with this",neutral,"['sucked', 'notebook', 'content', 'kernel', 'us', 'displaying', 'name', 'video', 'thoufiq', 'freshers', 'project', 'really', 'trying', 'solve', 'help', 'created', 'people', 'useful', 'show', 'hi', 'spy', 'career', 'juster', 'analytical', 'data', 'environment', 'helpful', 'still', 'problem', 'please', 'pursue', 'actually', 'want', 'like', 'installing', 'tried', 'virtual']",37,0.8203,0.202,0.08,0.719
169,169,fbalseiro,2022-02-28,2022-02-28,1,0.9778955,his great tutorial congratulations for your work it really helped me a lot to know how to work with couture paid,pos,"['helped', 'couture', 'really', 'work', 'lot', 'great', 'know', 'paid', 'tutorial', 'congratulations']",10,0.8402,0.308,0.0,0.692
170,170,sameermehdi3143,2022-02-26,2022-02-26,1,0.9821016,thankyou so much for this wonderful tutorial and from my analysis you posted most video on can and few up,pos,"['analysis', 'much', 'wonderful', 'posted', 'video', 'tutorial', 'thankyou']",7,0.657,0.187,0.0,0.813
171,171,maryamazam402,2022-02-25,2022-02-25,0,0.95886904,amazing video thank you so much would like to know how to get video details of multiple channels at a time can you please suggest how to do it,pos,"['much', 'details', 'time', 'get', 'channels', 'please', 'thank', 'would', 'like', 'know', 'video', 'suggest', 'amazing', 'multiple']",14,0.885,0.321,0.0,0.679
172,172,gurusaini2607,2022-02-16,2022-02-16,0,-0.08158183,hi sir is it possible to scrape numbers from justdial?,neutral,"['hi', 'scrape', 'sir', 'possible', 'numbers', 'justdial']",6,0.0,0.0,0.0,1.0
173,173,justenjoy600,2022-02-12,2022-02-12,1,-0.34503987,his what to do if i don't have this 'yt-env' in new notebook drop menu in jupyter?,neutral,"['menu', 'notebook', 'jupyter', 'drop', 'new']",5,-0.2732,0.0,0.123,0.877
174,174,Rapha_Carpio,2022-02-11,2022-02-11,0,-0.13549988,"pro - thank you very much for this i got an issue though i run my project in visual studio i added 7 links to analyze 7 channels instead of 4 and it only shows me 4. and then it shows me all these errors --------------------------------------------------------------------------- indexerror traceback c:\users\utente\appdata\local\programs\python\yt-analysis-project.ipynb cell 14' in module ---- 1 playlist_id channel_data.loc'ken jeep 'playlist_id'].iloc file ~\appdata\local\programs\python\python310\lib\site-packages\pandas\core\indexing.py:967, in _locationindexer.__getitem__ 964 axis self.axis or 0 966 maybe_callable com.apply_if_callable i 967 return self._getitem_axis file ~\appdata\local\programs\python\python310\lib\site-packages\pandas\core\indexing.py:1520, in _ilocindexer._getitem_axis 1517 raise typeerror 1519 validate the location - 1520 self._validate_integer 1522 return self.obj._ixs file ~\appdata\local\programs\python\python310\lib\site-packages\pandas\core\indexing.py:1452, in _ilocindexer._validate_integer 1450 len_axis lend 1451 if key len_axis or key -len_axis: - 1452 raise indexerror indexerror: single positional indexer is out-of-bounds*can you help me please",neutral,"['indexerror', 'single', 'thank', 'raise', '14', 'indexer', 'pro', '1451', 'cell', 'channels', 'traceback', 'got', 'much', 'project', '967', 'c', 'key', '1452', '964', 'positional', 'help', 'though', 'analyze', '1517', '1450', 'validate', 'added', 'module', '1522', 'axis', 'location', 'return', 'studio', '1520', 'jeep', 'issue', '0', 'typeerror', 'lend', '1', '966', '4', 'run', 'please', 'instead', '7', 'file', 'errors', 'visual', '1519', 'links', 'shows']",52,0.765,0.087,0.021,0.893
175,175,dataneeds2266,2022-02-05,2022-02-05,1,0.90566105,wow amazing,pos,"['amazing', 'wow']",2,0.8225,1.0,0.0,0.0
176,176,tharana,2022-01-27,2022-01-27,1,0.78262186,thanks for this informative video how to get all comments with permission using paid and can the above data be stored in the text file in real-time?,pos,"['comments', 'thanks', 'stored', 'permission', 'get', 'file', 'informative', 'using', 'video', 'paid', 'text', 'data']",12,0.4404,0.1,0.0,0.9
177,177,ananyapandey7576,2022-01-24,2022-01-24,0,-0.78164315,"hi taufiq,i'm not able to import google-api-python-client in juster notebook have tried almost everything can you please help",neg,"['hi', 'able', 'almost', 'taufiq', 'please', 'import', 'notebook', 'everything', 'help', 'juster', 'tried']",11,0.6124,0.238,0.0,0.762
178,178,ImranAhmed-vl5po,2022-01-21,2022-01-21,1,0.9743425,good work tafia thanks for sharing,pos,"['good', 'thanks', 'work', 'sharing', 'tafia']",5,0.8225,0.741,0.0,0.259
179,179,attaullaharif4371,2022-01-18,2022-01-18,1,-0.016839921,"i followed step by step instructions , but found 'pageinfo': how to fix it",neutral,"['step', 'found', 'followed', 'fix', 'instructions']",5,0.0,0.0,0.0,1.0
180,180,amakae1978,2022-01-15,2022-01-15,0,0.52219397,"hi thoufiq, great job you're doing absolutely love this it'd like to know if you've worked on getting all the channel ids of youtubers based on their location or country idea all channel ids in a country also while working on this project i got errors trying to access the video ids using the playlet ids and i have been unable to go passed that any idea on what the issue might be thanks for your educative content kind regards",pos,"['unable', 'content', 'video', 'thoufiq', 'love', 'educative', 'idea', 'might', 'got', 'worked', 'project', 'trying', 'kind', 'youtubers', 'country', 'based', 'great', 'go', 'access', 'hi', 'getting', 'job', 'location', 'absolutely', 'channel', 'also', 'passed', 'issue', 'thanks', 'playlet', 'working', 'errors', 'like', 'know', 'using', 'regards', 'ids']",37,0.9432,0.192,0.026,0.782
181,181,riteshsharma3627,2021-12-25,2021-12-25,1,0.046373047,"hey taufiq, how to prepare/ask these questions while practicing sol with datasets? elaborate in detail in upcoming videos",neutral,"['taufiq', 'elaborate', 'hey', 'detail', 'questions', 'videos', 'sol', 'practicing', 'datasets', 'upcoming']",10,0.0,0.0,0.0,1.0
182,182,190HITMAN,2021-12-23,2021-12-23,4,0.9815119,"hi thoufiq, excellent video absolutely loved it please keep creating many more project videos can you make a short video on how to visualize data using python as dynamic radar charts",pos,"['visualize', 'radar', 'many', 'video', 'thoufiq', 'project', 'short', 'keep', 'excellent', 'make', 'hi', 'loved', 'charts', 'videos', 'absolutely', 'data', 'creating', 'python', 'please', 'using', 'dynamic']",21,0.9355,0.379,0.0,0.621
183,183,blueresolve2954,2021-12-22,2021-12-22,1,0.4011555,nice is this achievable with re,neutral,"['achievable', 'nice']",2,0.6249,0.56,0.0,0.44
184,184,dakshbhatnagar,2021-12-18,2021-12-18,3,0.8856316,thanks brother this was a bit intricate for me as i have just started out learning python for data analysis but the tricks you have used are new and i am eager to learn and use them and create a new project based off of this information don't worry keep at it you will be bigger than ken see one day just stay consistent,pos,"['analysis', 'intricate', 'tricks', 'day', 'used', 'project', 'learn', 'stay', 'started', 'based', 'keep', 'ken', 'new', 'one', 'consistent', 'learning', 'create', 'brother', 'use', 'see', 'data', 'bit', 'python', 'eager', 'thanks', 'information', 'worry', 'bigger']",28,0.8594,0.18,0.026,0.794
185,185,haneeshabestha5092,2021-12-16,2021-12-16,0,-0.8475005,"hi sir am working on up project rat nw,but unable to execute the codes properly,either we are getting an error or we are not getting output . can you plus help us sir",neg,"['hi', 'project', 'execute', 'sir', 'rat', 'unable', 'getting', 'either', 'error', 'codes', 'working', 'nw', 'output', 'help', 'properly', 'plus', 'us']",17,0.0,0.076,0.076,0.847
186,186,srvos,2021-11-23,2021-11-23,2,-0.12385577,"hi thoufiq, great tutorial just getting started here with python one quick question i don't see the yt-env in my juster notebook but did start juster from the yt-env in my terminal any idea on where this went wrong kind regards stepson",neutral,"['notebook', 'wrong', 'thoufiq', 'tutorial', 'idea', 'kind', 'started', 'quick', 'great', 'question', 'one', 'hi', 'went', 'getting', 'juster', 'terminal', 'see', 'python', 'start', 'stepson', 'regards']",21,0.4588,0.145,0.084,0.771
187,187,laurak5196,2021-11-17,2021-11-17,11,0.9883739,"hi thoufiq, this is very impressive ism watching this purely out of curiosity be have not started my python class yet however i would love to see sol project ideas maybe for data cleaning anchor analysis thanks as always for your clear explanations and guidance also very glad to see you're closing in on 15k, friend congratulations in advance",pos,"['ism', 'analysis', 'clear', 'class', 'ideas', 'curiosity', 'always', 'glad', 'thoufiq', 'love', 'cleaning', 'friend', 'project', 'started', 'however', 'sol', 'watching', 'congratulations', 'hi', 'advance', 'closing', 'maybe', 'explanations', 'purely', 'see', 'data', 'also', 'impressive', 'python', 'thanks', '15k', 'yet', 'guidance', 'would', 'anchor']",35,0.9741,0.317,0.0,0.683
188,188,shivsharma9153,2021-11-12,2021-11-12,1,-0.060704038,amazinnnggggg,neutral,['amazinnnggggg'],1,0.0,0.0,0.0,1.0
189,189,venkatesanvenki3721,2021-11-05,2021-11-05,0,-0.038778774,hi brow i need presto quarry to retried yesterday date end select * from table name where date_name yesterday please help,neutral,"['hi', 'need', 'yesterday', 'end', 'table', 'quarry', 'brow', 'please', 'retried', 'select', 'date', 'help', 'name', 'presto']",14,0.6124,0.227,0.0,0.773
191,191,varalakshmidanda2684,2021-10-19,2021-10-19,1,0.97605747,excellent work and great explanation sir waiting for more of challenging videos,pos,"['work', 'sir', 'explanation', 'waiting', 'great', 'videos', 'excellent', 'challenging']",8,0.8651,0.518,0.0,0.482
192,192,Anonymous-le2zr,2021-10-17,2021-10-17,2,0.9874941,"one of the best analysis video i have seen so faramazing content , expecting videos on some more projects appreciate your hard work i",pos,"['projects', 'analysis', 'hard', 'work', 'best', 'expecting', 'content', 'videos', 'appreciate', 'video', 'seen', 'faramazing', 'one']",13,0.7769,0.27,0.053,0.677
193,193,adrianafressato8489,2021-10-15,2021-10-15,1,0.8793874,great class,pos,"['great', 'class']",2,0.6249,0.804,0.0,0.196
194,194,LP-ig8tg,2021-10-14,2021-10-14,0,0.24583004,if possible deployment at repositories also be preferred,neutral,"['repositories', 'preferred', 'possible', 'deployment', 'also']",5,0.0,0.0,0.0,1.0
195,195,LP-ig8tg,2021-10-14,2021-10-14,0,0.92089903,great tutorial thanks brow also would highly appreciate if you can make similar video on how to grab each viewers data i have been looking for extracting periodical data of viewership subscribers comments likes & dislikes et of each user so as to export it to the googly sheet for rendering the process further any other references or sources to this subject referred shall be highly appreciated,pos,"['export', 'googly', 'sources', 'process', 'looking', 'video', 'referred', 'subscribers', 'tutorial', 'dislikes', 'likes', 'rendering', 'viewership', 'great', 'et', 'make', 'user', 'periodical', 'similar', 'appreciate', 'grab', 'data', 'also', 'comments', 'subject', 'thanks', 'brow', 'viewers', 'appreciated', 'references', 'shall', 'highly', 'would', 'extracting', 'sheet']",35,0.9285,0.21,0.035,0.756
196,196,venugopal-nc3nz,2021-10-14,2021-10-14,2,0.007377945,can we able to find subscriber name of different couture channel,neutral,"['able', 'different', 'couture', 'name', 'subscriber', 'channel', 'find']",7,0.0,0.0,0.0,1.0
197,197,lordmelbury7174,2021-10-14,2021-10-14,2,-0.4084745,man don't show your ape key,neutral,"['ape', 'man', 'key', 'show']",4,0.0,0.0,0.0,1.0
198,198,kancherlavenumadhav9360,2021-10-14,2021-10-14,3,0.94287854,really interested in this stuff and fabulous explanation ...also please do videos on data science how to begin from scratch ......,pos,"['interested', 'really', 'scratch', 'please', 'stuff', 'explanation', 'videos', 'science', 'fabulous', 'begin', 'data', 'also']",12,0.8268,0.326,0.0,0.674
199,199,saurabhgupta-yi3mq,2021-10-13,2021-10-13,1,-0.7619637,"hello , i tried to learn from your video , but i m not able to get the result",neg,"['able', 'result', 'hello', 'learn', 'get', 'video', 'tried']",7,0.0,0.0,0.0,1.0
200,200,kamalverma6064,2021-10-13,2021-10-13,2,0.9755831,you are so brilliant,pos,['brilliant'],1,0.7065,0.619,0.0,0.381
201,201,fathimafarahna2633,2021-10-13,2021-10-13,3,0.8458732,fab as always... concise and on fleet keep up,pos,"['concise', 'fleet', 'always', 'fab', 'keep']",5,0.4588,0.273,0.0,0.727
202,202,mohammedshahil4898,2021-10-13,2021-10-13,1,0.919595,was waiting for thisthanks a lot brother for this very helpful video way to go,pos,"['way', 'lot', 'waiting', 'thisthanks', 'video', 'brother', 'go', 'helpful']",8,0.4754,0.192,0.0,0.808
203,203,sultankhatri7230,2021-10-13,2021-10-13,6,0.97838336,thanks a lot for this video!!! bow liked and of already subscribed.please upload more videos of projects,pos,"['projects', 'thanks', 'liked', 'upload', 'lot', 'videos', 'video', 'bow', 'already']",9,0.7633,0.32,0.0,0.68
204,204,mianawais99,2024-06-29,2024-06-29,0,0.9375897,best ever detailed and well explained video on db normalization,pos,"['db', 'well', 'best', 'explained', 'detailed', 'video', 'ever', 'normalization']",8,0.743,0.441,0.0,0.559
205,205,manohar9300,2024-06-26,2024-06-26,0,-0.9274912,what's the use of stratascratch when it's not showing output ? how to know it's cut output ? very bad,neg,"['bad', 'output', 'know', 'cut', 'use', 'showing', 'stratascratch']",7,-0.7394,0.0,0.281,0.719
206,206,konikiajaybabuchinu867,2024-06-24,2024-06-24,0,0.9817642,its very useful to us and wonderful explanation thank you sir,pos,"['wonderful', 'sir', 'thank', 'explanation', 'us', 'useful']",6,0.8553,0.54,0.0,0.46
207,207,ramprasadsomaraju3889,2024-06-23,2024-06-23,0,0.98245883,you are the best,pos,['best'],1,0.6369,0.583,0.0,0.417
208,208,user-xu2le9dq1c,2024-06-22,2024-06-22,0,0.012102678,mama aga such we,neutral,"['mama', 'aga']",2,0.0,0.0,0.0,1.0
209,209,taymoorrathore8446,2024-06-20,2024-06-20,0,-0.05759434,can you please explain how to normalize for is normal stage checking if there are any double entries in a table with 1000s of rows and is of columns,neutral,"['explain', 'table', '1000s', 'double', 'please', 'stage', 'columns', 'checking', 'normalize', 'rows', 'normal', 'entries']",12,0.3182,0.078,0.0,0.922
210,210,shekharbhise9295,2024-06-18,2024-06-18,0,0.9720278,excellentloved it,pos,['excellentloved'],1,0.0,0.0,0.0,1.0
211,211,-TechLearning,2024-06-17,2024-06-17,0,0.9820466,it was really amazing the way you explain the concept is simply awesome i request you to please make video on same concept with a dataset in sol and how we need to do in sol with different queries,pos,"['way', 'explain', 'simply', 'request', 'need', 'different', 'really', 'please', 'awesome', 'sol', 'video', 'dataset', 'queries', 'amazing', 'concept', 'make']",16,0.8883,0.236,0.0,0.764
212,212,USA_to_Asia_in_2024,2024-06-16,2024-06-16,0,0.9898317,thank you so much for this video.remarkable!,pos,"['much', 'thank']",2,0.4199,0.318,0.0,0.682
213,213,okpeamaka5279,2024-06-15,2024-06-15,0,0.0886677,please do you mind sharing the dataset you used for this so we can follow along with you,neutral,"['follow', 'used', 'please', 'sharing', 'along', 'dataset', 'mind']",7,0.6249,0.242,0.0,0.758
214,214,sammail96,2024-06-14,2024-06-14,0,0.0138153955,can you share sheet,neutral,"['share', 'sheet']",2,0.296,0.423,0.0,0.577
215,215,jameskelly3574,2024-06-11,2024-06-11,0,0.9625797,"just ""wow"". i have been struggling to understand normalization for my db class you used a great visual example and i love how you copied the table from 1 form to the next so we could see the process building upon itself as we get to the higher levels of normalization you just earned a sub and like thanks so much",pos,"['class', 'next', 'process', 'love', 'table', 'much', 'used', 'great', 'sub', 'example', 'normalization', 'levels', 'form', 'understand', 'get', 'higher', 'could', 'copied', 'upon', 'see', 'db', 'thanks', '1', 'earned', 'visual', 'wow', 'struggling', 'like', 'building']",29,0.8979,0.203,0.041,0.756
216,216,pranajpatil903,2024-06-10,2024-06-10,0,0.9699135,i have learned sol from different platforms but never understood this concept but for the first time i felt it was so easy thankyou so much sir for such great videos,pos,"['different', 'platforms', 'felt', 'much', 'understood', 'sir', 'time', 'first', 'videos', 'learned', 'great', 'sol', 'never', 'concept', 'easy', 'thankyou']",16,0.9146,0.285,0.0,0.715
217,217,fitnessholicmallu3588,2024-06-09,2024-06-09,0,0.970864,thank your sir for this valuable content,pos,"['sir', 'valuable', 'content', 'thank']",4,0.729,0.551,0.0,0.449
218,218,vickysreeramadas6386,2024-06-03,2024-06-03,0,0.8562954,sir an awesome explanation just like one video whole concept of normalization cleared,pos,"['cleared', 'sir', 'awesome', 'explanation', 'like', 'whole', 'video', 'normalization', 'concept', 'one']",10,0.7906,0.444,0.0,0.556
219,219,bharath8017,2024-05-31,2024-05-31,0,0.8161417,"too good sir,been searching in various other channels for this content but i could not understand anything,but your content and explanation was too good that i can understand by just a single watch",pos,"['understand', 'good', 'single', 'sir', 'watch', 'various', 'content', 'explanation', 'could', 'searching', 'anything', 'channels']",12,0.7003,0.172,0.0,0.828
220,220,endalekinfe3391,2024-05-29,2024-05-29,0,0.9838154,that is wonderful explanation thank you so much sir,pos,"['much', 'wonderful', 'sir', 'thank', 'explanation']",5,0.7351,0.47,0.0,0.53
221,221,shravyatharapatti,2024-05-29,2024-05-29,0,0.7896362,"best way of explaining nf's,first time i understood the concepts clearly",pos,"['way', 'understood', 'best', 'time', 'concepts', 'first', 'nf', 'clearly', 'explaining']",9,0.7845,0.463,0.0,0.537
222,222,vijaygupta7066,2024-05-28,2024-05-28,0,0.2951185,till now i read many post articles but unable to understand but from your video i got proper understanding on couture you and admit banal content are like breaking hard problems and explaining in simple manner,neutral,"['proper', 'couture', 'unable', 'content', 'many', 'read', 'video', 'problems', 'hard', 'till', 'explaining', 'got', 'post', 'understand', 'breaking', 'articles', 'admit', 'understanding', 'like', 'manner', 'banal', 'simple']",22,0.0772,0.134,0.127,0.739
223,223,mohankrishna6042,2024-05-16,2024-05-16,0,0.77043796,good explanation sir,pos,"['sir', 'good', 'explanation']",3,0.4404,0.592,0.0,0.408
224,224,parthibangopi8393,2024-05-15,2024-05-15,0,0.3248194,i was very confused in this concept and have seen many videos and no one explained the way you explained you are awesome expecting more videos related to sell thank you,neutral,"['way', 'related', 'expecting', 'awesome', 'videos', 'many', 'explained', 'sell', 'thank', 'seen', 'concept', 'one', 'confused']",13,0.4228,0.177,0.128,0.695
225,225,sandeeppetkar7586,2024-05-13,2024-05-13,0,0.8617298,"its one of the best video to understand the concept of normalization just had one doubt instead of relationships table can we place product_code, customer_id in orders table as foreign key",pos,"['understand', 'table', 'best', 'foreign', 'key', 'instead', 'place', 'video', 'doubt', 'relationships', 'normalization', 'orders', 'concept', 'one']",14,0.4019,0.118,0.07,0.812
226,226,hecksonchamutanga1990,2024-05-10,2024-05-10,0,0.95335263,thanks a lot for making me understand,pos,"['making', 'understand', 'thanks', 'lot']",4,0.4404,0.367,0.0,0.633
227,227,VaishnaviShinde-hh8sg,2024-05-09,2024-05-09,0,0.98091424,you are the best teacher.your all sol videos are best for learning your explanation throughout the videos is mindblowing. please make more videos on sol,pos,"['learning', 'throughout', 'mindblowing', 'best', 'please', 'explanation', 'videos', 'sol', 'make']",9,0.8934,0.327,0.0,0.673
228,228,minithyagraj6692,2024-05-06,2024-05-06,0,0.8626981,very well explained this concept couldn't be made simpler thank you,pos,"['well', 'made', 'thank', 'explained', 'could', 'concept', 'simpler']",7,0.5984,0.352,0.0,0.648
229,229,user-oy8yw8dr6b,2024-05-03,2024-05-03,0,-0.027313933,hey techtfq! can you please give the link of the dataset you used in this video,neutral,"['used', 'hey', 'please', 'give', 'dataset', 'video', 'techtfq', 'link']",8,0.3802,0.147,0.0,0.853
230,230,travelnlearn,2024-05-03,2024-05-03,0,0.964192,amazing video i completely got entire concept in 1 video,pos,"['got', '1', 'entire', 'completely', 'video', 'amazing', 'concept']",7,0.5859,0.352,0.0,0.648
231,231,pavanthezen8188,2024-05-02,2024-05-02,0,0.41816157,"very nice video , could you please make a video on one to relationship and one to many relationship and many to many relationship , that topic is still hard to understand for me",neutral,"['still', 'topic', 'understand', 'please', 'nice', 'relationship', 'many', 'could', 'video', 'hard', 'one', 'make']",12,0.6115,0.155,0.04,0.805
232,232,hafizmoizmoiz6901,2024-05-01,2024-05-01,0,0.95930076,very informative tutorial all my concepts are clear now keep it up,pos,"['clear', 'concepts', 'informative', 'keep', 'tutorial']",5,0.3818,0.191,0.0,0.809
