Unnamed: 0,id,author,published_at,updated_at,like_count,sentiment_score,text,labeled_status,unique_tokens,token_count,compound_score,positive_score,negative_score,neutral_score
326,326,anuragshah3433,2023-08-04,2023-08-04,6,-0.31294024,for those who are confused on transitive dependency in info if we just look at the output of info ordered - order number and order number - sales contact first name and order number - sale contact second name hence there is a transitive dependency it was not flagged in and as order id - sales contact first name and order id - sales contact second name hence these are completely dependent on pa as well,neutral,"['transitive', 'info', 'output', 'first', 'name', 'hence', 'second', 'look', 'id', 'contact', 'confused', 'flagged', 'well', 'number', 'dependency', 'completely', 'sale', 'dependent', 'order', 'sales', 'pa', 'ordered']",22,0.1779,0.082,0.031,0.887
327,327,madhurima8813,2023-08-01,2023-08-01,0,0.7689054,very well explained,pos,"['explained', 'well']",2,0.3384,0.545,0.0,0.455
328,328,basavapn6487,2023-07-30,2023-07-30,0,-0.023801096,can you please show us the implementation in mealtime in database having data in the tables in demoralized form,neutral,"['mealtime', 'please', 'us', 'demoralized', 'database', 'form', 'tables', 'data', 'implementation', 'show']",10,-0.0772,0.105,0.119,0.776
329,329,basavapn6487,2023-07-30,2023-07-30,0,0.9791009,"just awesome as always , appreciate the knowledge share",pos,"['awesome', 'always', 'appreciate', 'knowledge', 'share']",5,0.8402,0.643,0.0,0.357
330,330,sohelshaikh9678,2023-07-27,2023-07-27,0,0.95253855,you are great trainer is reason to follow you sir,pos,"['follow', 'sir', 'great', 'trainer', 'reason']",5,0.6249,0.313,0.0,0.687
331,331,siva5169,2023-07-27,2023-07-27,0,0.0060763136,can you please provide the dataset link,neutral,"['link', 'please', 'provide', 'dataset']",4,0.3182,0.277,0.0,0.723
332,332,rinzi111,2023-07-24,2023-07-24,0,0.034227654,very clearly explained the concept of normalization i was wondering how can the same be implied in there are hundreds of columns you have manually added product code for duplicates in relationships table but how's it possible to update if the data is large that,neutral,"['duplicates', 'large', 'explained', 'possible', 'implied', 'relationships', 'table', 'update', 'wondering', 'normalization', 'hundreds', 'added', 'code', 'columns', 'product', 'data', 'manually', 'clearly', 'concept']",19,0.2492,0.044,0.0,0.956
333,333,manikantashet5921,2023-07-23,2023-07-23,1,0.9694195,amazing explanation and clarity thank you,pos,"['thank', 'amazing', 'clarity', 'explanation']",4,0.8402,0.75,0.0,0.25
334,334,Joshua_t_,2023-07-22,2023-07-22,1,0.9683026,great video working through the example database helps a lot,pos,"['working', 'lot', 'great', 'database', 'video', 'example', 'helps']",7,0.7717,0.489,0.0,0.511
335,335,mullaipugazhendi3236,2023-07-20,2023-07-20,0,0.9599586,yes the best video to understand normalization thank you very much could you please upload a video on er diagram in details,pos,"['understand', 'much', 'best', 'yes', 'please', 'upload', 'details', 'thank', 'er', 'could', 'video', 'diagram', 'normalization']",13,0.8934,0.408,0.0,0.592
336,336,user-qx3xz2me3h,2023-07-18,2023-07-18,0,0.98631114,thank you thank you so much for knowledge sharing with us in good understanding manner love your content and your way of explanation too,pos,"['way', 'much', 'good', 'love', 'sharing', 'content', 'thank', 'understanding', 'explanation', 'us', 'manner', 'knowledge']",12,0.9313,0.44,0.0,0.56
337,337,anjuaj363,2023-07-17,2023-07-17,0,0.80247235,very well explained sir,pos,"['explained', 'well', 'sir']",3,0.3384,0.444,0.0,0.556
338,338,user-dk5cs2sg6v,2023-07-14,2023-07-14,0,0.9353234,very very excellent,pos,['excellent'],1,0.6453,0.681,0.0,0.319
339,339,joaofstock,2023-07-13,2023-07-13,0,0.9073384,i have to say that i have made 3 courses with modules about data modeling and schemas and this is the first time that ism recalling understanding how to build an er diagram many thanks for your explanation and all the best,pos,"['ism', 'modules', 'first', 'many', 'diagram', 'made', 'schemas', 'time', 'best', '3', 'recalling', 'data', 'build', 'thanks', 'courses', 'understanding', 'er', 'say', 'explanation', 'modeling']",20,0.7964,0.161,0.0,0.839
340,340,dannycollins5698,2023-07-12,2023-07-12,1,0.9882067,this was a lot of fun and very helpful you did an excellent job liked and subscribed,pos,"['subscribed', 'liked', 'fun', 'job', 'lot', 'excellent', 'helpful']",7,0.9168,0.518,0.0,0.482
341,341,yamunau.yamuna5189,2023-07-02,2023-07-02,0,0.83702046,super explanation thanks bromate one video for indexes topic pro,pos,"['topic', 'thanks', 'super', 'indexes', 'explanation', 'video', 'pro', 'bromate', 'one']",9,0.7783,0.459,0.0,0.541
342,342,Ashokkumar-xf8fn,2023-06-29,2023-06-29,0,0.9620242,very well explained thanks a lot,pos,"['explained', 'well', 'thanks', 'lot']",4,0.6764,0.649,0.0,0.351
343,343,esotericwanderer6473,2023-06-24,2023-06-24,0,0.038264796,to,neutral,[],0,0.0,0.0,0.0,1.0
344,344,pankajdhome,2023-06-22,2023-06-22,0,0.9778106,very well explained thanks a lot for such valuable content,pos,"['well', 'thanks', 'content', 'lot', 'explained', 'valuable']",6,0.8251,0.591,0.0,0.409
345,345,vignesan4197,2023-06-19,2023-06-19,1,0.9809375,i love your way of explanation and your sol series will give a clear idea about basic to advanced levels of sol skills thanks,pos,"['way', 'idea', 'clear', 'thanks', 'series', 'give', 'explanation', 'basic', 'sol', 'advanced', 'love', 'skills', 'levels']",13,0.8934,0.394,0.0,0.606
346,346,amirtahaehsaei1609,2023-06-15,2023-06-15,0,0.87847865,brief solid and easy to understand thumbs up,pos,"['understand', 'brief', 'thumbs', 'solid', 'easy']",5,0.5423,0.429,0.0,0.571
347,347,parandama4589,2023-06-14,2023-06-14,0,0.042017933,please share the dataset,neutral,"['please', 'dataset', 'share']",3,0.5423,0.692,0.0,0.308
348,348,parandama4589,2023-06-14,2023-06-14,1,0.30754778,your a master of ribs concepts,neutral,"['ribs', 'concepts', 'master']",3,0.0,0.0,0.0,1.0
349,349,bhaveshbharti9202,2023-06-12,2023-06-12,0,-0.48474708,than tafia,neutral,['tafia'],1,0.0,0.0,0.0,1.0
350,350,david-mc8hc,2023-06-10,2023-06-10,0,0.9530644,bravo very good examples and great/neat presentation i have been struggling with this topic for quite sometime and now i can put it to rest thank you,pos,"['presentation', 'topic', 'good', 'bravo', 'put', 'rest', 'thank', 'quite', 'struggling', 'examples', 'sometime']",11,0.4391,0.187,0.092,0.721
351,351,iamnoob7593,2023-06-10,2023-06-10,2,0.91722935,"hands down , best video on normalization in entire internet",pos,"['best', 'entire', 'normalization', 'video', 'internet', 'hands']",6,0.6369,0.344,0.0,0.656
352,352,rajmittal5394,2023-06-08,2023-06-08,0,0.93375915,"thanks sir , its very informative",pos,"['sir', 'informative', 'thanks']",3,0.4404,0.42,0.0,0.58
353,353,AbdulRehman-nv5xc,2023-06-07,2023-06-07,0,-0.50357115,i think customers table is not in and because there exists a transitive dependency in city and postal code,neg,"['transitive', 'table', 'code', 'postal', 'dependency', 'city', 'exists', 'customers', 'think']",9,0.0,0.0,0.0,1.0
354,354,AbdulRehman-nv5xc,2023-06-07,2023-06-07,0,0.16523938,can you please share this excel sheet,neutral,"['please', 'excel', 'share', 'sheet']",4,0.7579,0.652,0.0,0.348
355,355,yordanosadigo,2023-06-07,2023-06-07,0,0.77077615,no one explained this like you do....thank you,pos,"['explained', 'like', 'one', 'thank']",4,0.1717,0.26,0.199,0.542
356,356,abhijitmane9949,2023-06-06,2023-06-06,0,-0.07987842,"about sales , we could have separated sales detail in and of only why need and of i mean employee table",neutral,"['need', 'separated', 'table', 'detail', 'sales', 'employee', 'could', 'mean']",8,0.0,0.0,0.0,1.0
357,357,utbkpreparation1401,2023-06-04,2023-06-04,0,0.718359,great explanation,pos,"['great', 'explanation']",2,0.6249,0.804,0.0,0.196
358,358,bhaveshbharti4782,2023-06-02,2023-06-02,0,0.9485432,epic thankyou so much,pos,"['thankyou', 'much', 'epic']",3,0.0,0.0,0.0,1.0
359,359,liberatingpanda7878,2023-06-01,2023-06-01,0,0.32411933,you should be a lecturer....made me understood the concept better than my current prof who took 3 his and i did not understand shut,neutral,"['understand', 'made', 'understood', 'better', '3', 'lecturer', 'prof', 'shut', 'current', 'concept', 'took']",11,0.4404,0.127,0.0,0.873
360,360,monish2897,2023-05-26,2023-05-26,0,0.5753434,great,pos,['great'],1,0.6249,1.0,0.0,0.0
361,361,Nivibaa,2023-05-25,2023-05-25,0,0.32214722,good explainhow to normalization flat table text in sol after import text flat file,neutral,"['table', 'good', 'import', 'explainhow', 'file', 'flat', 'sol', 'normalization', 'text']",9,0.4404,0.182,0.0,0.818
362,362,shorakhutte1887,2023-05-24,2023-05-24,0,0.844494,very clearly explained my doubts got clear thanks for providing valuable content,pos,"['got', 'clear', 'thanks', 'content', 'explained', 'doubts', 'clearly', 'providing', 'valuable']",9,0.8553,0.558,0.106,0.337
363,363,Mallickbabu,2023-05-24,2023-05-24,0,0.11368759,"you are not a human , you are my sol god",neutral,"['sol', 'human', 'god']",3,0.2732,0.208,0.0,0.792
364,364,ur8946,2023-05-22,2023-05-22,0,0.052810363,hi sir could you plus share the excel sheet which you used in video,neutral,"['hi', 'plus', 'used', 'sir', 'could', 'video', 'excel', 'share', 'sheet']",9,0.6369,0.302,0.0,0.698
365,365,joshuastates,2023-05-15,2023-05-15,1,0.94101125,great video thoufiq. very clear explanations,pos,"['clear', 'great', 'explanations', 'video', 'thoufiq']",5,0.7902,0.636,0.0,0.364
366,366,PatrickMuvunyi10,2023-05-13,2023-05-13,1,0.9446377,thanks for making it crystal clear satisfied,pos,"['clear', 'thanks', 'satisfied', 'making', 'crystal']",5,0.8074,0.675,0.0,0.325
367,367,micaelzekarias1537,2023-05-05,2023-05-05,0,0.9805005,up way of explaining things are so interesting keep it up love up way of teaching gnu,pos,"['way', 'teaching', 'things', 'interesting', 'gnu', 'keep', 'love', 'explaining']",8,0.8267,0.339,0.0,0.661
368,368,berknoyan7594,2023-05-03,2023-05-03,0,-0.009625539,like xu times thank you man for the last example i think we should keep product price with an update column because it will look incorrect if we look product price later,neutral,"['incorrect', 'column', 'look', 'later', 'man', 'update', 'thank', 'like', 'keep', 'example', 'product', 'xu', 'think', 'price', 'last', 'times']",16,0.6124,0.147,0.0,0.853
369,369,vasuhii2250,2023-05-03,2023-05-03,0,-0.024256073,"please explain hash,saragotekey like advanced concepts",neutral,"['explain', 'please', 'concepts', 'like', 'advanced', 'hash', 'saragotekey']",7,0.7003,0.694,0.0,0.306
370,370,naveenjoshi7892,2023-05-02,2023-05-02,0,0.80302507,awesome brother,pos,"['awesome', 'brother']",2,0.6249,0.804,0.0,0.196
371,371,omkargurme20,2023-05-01,2023-05-01,0,0.9478759,very well explained sir thank you for the information,pos,"['well', 'information', 'sir', 'thank', 'explained']",5,0.5984,0.411,0.0,0.589
372,372,ferdinandwenzl2698,2023-04-27,2023-04-27,0,-0.3064703,38:40 if an entry is deleted from the order table the relationship table must also be updated,neutral,"['updated', 'table', 'entry', 'must', 'order', 'relationship', 'deleted', 'also']",8,0.0,0.0,0.0,1.0
373,373,virenderpatra471,2023-04-25,2023-04-25,0,0.7430433,sir you are doing great job have 2 data type related quarry can u help me with that like suppose my column data is like 'googleone' and second column is 'google-13' what data type can i use in sol for these kind of data,pos,"['second', 'quarry', 'sir', 'kind', 'job', 'help', 'u', 'great', 'type', 'like', 'use', 'sol', '2', 'column', 'related', 'data', 'suppose']",17,0.8957,0.242,0.0,0.758
374,374,naidubora2990,2023-04-18,2023-04-18,0,0.8507809,great explanation pro,pos,"['great', 'pro', 'explanation']",3,0.6249,0.672,0.0,0.328
375,375,katharsheriff6846,2023-04-15,2023-04-15,0,0.9817851,his !... this video is really good and thanks for giving me a sound knowledge of normalization and anomalies,pos,"['giving', 'good', 'thanks', 'really', 'video', 'sound', 'knowledge', 'anomalies', 'normalization']",9,0.8422,0.376,0.0,0.624
376,376,spiritualthoughts5813,2023-04-13,2023-04-13,0,0.97002363,that is very easy and well explained to understand for every one thank you sir,pos,"['understand', 'every', 'well', 'sir', 'thank', 'explained', 'easy', 'one']",8,0.7939,0.402,0.0,0.598
377,377,lokeshmadiga6215,2023-04-06,2023-04-06,0,0.16109478,"thank you thoufiq, i have one doubting a and relationship relationships table is needed",neutral,"['table', 'relationship', 'thank', 'needed', 'thoufiq', 'doubting', 'relationships', 'one']",8,0.0258,0.168,0.161,0.671
378,378,learnCodingTechguru,2023-04-04,2023-04-04,0,0.8619465,thanks pro nice explanation on normalization,pos,"['thanks', 'nice', 'explanation', 'pro', 'normalization']",5,0.6908,0.588,0.0,0.412
379,379,08-deveshparikh18,2023-04-02,2023-04-02,0,-0.04376574,naval bhaji hulk ya the i,neutral,"['bhaji', 'naval', 'ya', 'hulk']",4,0.0,0.0,0.0,1.0
380,380,breserskcrimp9310,2023-03-30,2023-03-30,0,0.9103845,best video so far on normalization,pos,"['best', 'normalization', 'video', 'far']",4,0.6369,0.457,0.0,0.543
381,381,INGCI_3694,2023-03-29,2023-03-29,0,0.9549011,thank you for providing valuable information,pos,"['valuable', 'information', 'providing', 'thank']",4,0.6808,0.583,0.0,0.417
382,382,bhupellygopikrishna3039,2023-03-29,2023-03-29,0,0.93105793,excellent explanation it cleared every doubt in normalization thanks,pos,"['cleared', 'every', 'thanks', 'explanation', 'excellent', 'doubt', 'normalization']",7,0.6705,0.516,0.161,0.323
383,383,Maya.1988,2023-03-25,2023-03-25,0,0.17325202,hi any dedicated course u have on sol performance and sol admit in demy will buy,neutral,"['hi', 'admit', 'buy', 'performance', 'u', 'sol', 'course', 'demy', 'dedicated']",9,0.5859,0.27,0.0,0.73
384,384,nitinchoudhary9015,2023-03-25,2023-03-25,0,0.9124312,real life example loved it,pos,"['loved', 'life', 'example', 'real']",4,0.5994,0.494,0.0,0.506
385,385,sonalijadhav9446,2023-03-23,2023-03-23,0,0.8530416,great explanation..no doubt...make videos on real time projects in sol,pos,"['projects', 'real', 'time', 'videos', 'explanation', 'great', 'sol', 'doubt', 'make']",9,0.6249,0.313,0.0,0.687
386,386,srinivashosur9964,2023-03-23,2023-03-23,0,0.9189285,great video and explained it in simple way it would be great if there is continuation video explaining normalization with sol commands instead of excel sheet,pos,"['way', 'commands', 'continuation', 'instead', 'normalization', 'explained', 'great', 'would', 'sol', 'video', 'simple', 'explaining', 'excel', 'sheet']",14,0.9042,0.327,0.0,0.673
387,387,sudarshansubramanian1019,2023-03-19,2023-03-19,1,0.7194139,great job explaining normalization would you be able to share the spreadsheet link ?,pos,"['able', 'job', 'normalization', 'great', 'spreadsheet', 'would', 'explaining', 'link', 'share']",9,0.743,0.364,0.0,0.636
388,388,s.m8766,2023-03-19,2023-03-19,0,-0.11545944,great video the thing that was missing for me was the part that you did in 24:50. how do i do that in large databases where i cant copy the missing data by hands,neutral,"['large', 'part', 'databases', 'great', 'thing', 'cant', 'copy', 'video', 'missing', 'hands', 'data']",11,0.1779,0.109,0.117,0.773
389,389,shadowitself,2023-03-18,2023-03-18,0,-0.28265405,"techtfqi got one concerned step i order table has duplicate because of , , in order to build genuine unique table shouldn't we create another table lets say which will get granularity to item level since right now we can not treat table as a unique one",neutral,"['right', 'step', 'since', 'treat', 'another', 'table', 'got', 'concerned', 'item', 'duplicate', 'one', 'create', 'genuine', 'get', 'lets', 'techtfqi', 'level', 'build', 'granularity', 'unique', 'order', 'say']",22,-0.4717,0.0,0.09,0.91
390,390,pavanmunagasetty6930,2023-03-18,2023-03-18,0,0.123637155,plus make a video group and havingclause,neutral,"['plus', 'havingclause', 'video', 'group', 'make']",5,0.0,0.0,0.0,1.0
391,391,GabrielOcheGodwin,2023-03-18,2023-03-18,0,0.88095593,got much value as usually thank for this sir,pos,"['got', 'much', 'value', 'sir', 'thank', 'usually']",6,0.5994,0.412,0.0,0.588
392,392,lakshmipathy6637,2023-03-16,2023-03-16,0,0.15223682,hi brow can you plus post videos for the data model with an example are plus refer to any website also,neutral,"['hi', 'plus', 'brow', 'also', 'videos', 'model', 'example', 'post', 'data', 'website', 'refer']",11,0.0,0.0,0.0,1.0
393,393,subodhpatel3179,2023-03-15,2023-03-15,0,0.94161236,thank you for making everything crystal clear,pos,"['clear', 'thank', 'making', 'crystal', 'everything']",5,0.6249,0.505,0.0,0.495
394,394,pachipulususaipradeep2762,2023-03-15,2023-03-15,0,-0.76554084,i am unable to find document in discord please share the document explained in this video,neg,"['unable', 'please', 'explained', 'discord', 'video', 'document', 'share', 'find']",8,0.2023,0.234,0.141,0.625
395,395,princenischal3515,2023-03-15,2023-03-15,0,0.9903156,i am really enjoying the video great and comprehensive content thumbs up i,pos,"['really', 'content', 'great', 'video', 'thumbs', 'enjoying', 'comprehensive']",7,0.8687,0.55,0.0,0.45
396,396,mahendranath2504,2023-03-14,2023-03-14,0,0.989199,thank you so much for such an awesome informative and comprehensive video surely i will recommend your channel a happy subscriber,pos,"['much', 'happy', 'surely', 'awesome', 'recommend', 'thank', 'informative', 'video', 'subscriber', 'channel', 'comprehensive']",11,0.9493,0.577,0.0,0.423
397,397,Rajnikapoor-vm4mm,2023-03-14,2023-03-14,0,0.96505564,you are truly amazing sir the way you describe each concept make it so clear and easy .... normalization is the topic which i always get to confuse but your explanation cleared all my doubts... thanks again,pos,"['way', 'topic', 'cleared', 'clear', 'thanks', 'sir', 'get', 'describe', 'normalization', 'always', 'explanation', 'doubts', 'confuse', 'truly', 'amazing', 'concept', 'easy', 'make']",18,0.8913,0.316,0.033,0.651
398,398,dineshvardam2176,2023-03-14,2023-03-14,1,0.9687172,you are really great sir you explained this complex concept in easiest way...,pos,"['way', 'really', 'sir', 'easiest', 'explained', 'great', 'complex', 'concept']",8,0.8016,0.395,0.0,0.605
399,399,shadowitself,2023-03-13,2023-03-13,1,0.98366505,as soon as i started my journey with sol databases i came across up channelevery film proves that it was super good choiceanother great contentthx,pos,"['channelevery', 'good', 'choiceanother', 'proves', 'across', 'super', 'soon', 'started', 'databases', 'great', 'sol', 'came', 'contentthx', 'journey', 'film']",15,0.8979,0.353,0.0,0.647
400,400,learnSQLdata,2023-03-13,2023-03-13,0,0.4143647,thanks for this could you please provide the file you have used in the video for better practice,neutral,"['thanks', 'used', 'please', 'better', 'provide', 'file', 'could', 'practice', 'video']",9,0.7964,0.351,0.0,0.649
401,401,EBKCS_SamarthGoyal,2023-03-13,2023-03-13,0,-0.34904885,sir i have learned myself but find it very difficult to build a project using it i request that you please make a video or series of videos on the project using myself,neutral,"['request', 'project', 'sir', 'please', 'series', 'videos', 'learned', 'difficult', 'using', 'video', 'make', 'build', 'find']",13,-0.1875,0.088,0.11,0.803
402,402,suriyars5662,2023-03-13,2023-03-13,0,0.90870845,there is no second thought if a video comes by techtfq the thing is it will have some insights which make us even better in that topic so i watch all videos even when i know the concepts also,pos,"['second', 'thought', 'topic', 'even', 'watch', 'better', 'comes', 'insights', 'videos', 'concepts', 'thing', 'us', 'know', 'video', 'techtfq', 'also', 'make']",17,0.1779,0.074,0.056,0.87
403,403,priyushat4619,2023-03-13,2023-03-13,0,0.062155254,hi can you please do one video on multiple table joins please and also how the functionality works whether like if you are joining 3 tables whether the third table join works on resultant set of first 2 tables or how does it works,neutral,"['first', 'join', 'video', '2', 'resultant', 'works', 'multiple', 'table', 'functionality', 'set', 'whether', 'one', 'hi', 'joining', '3', 'joins', 'also', 'please', 'third', 'like', 'tables']",21,0.8074,0.197,0.0,0.803
404,404,llKaiserx0ll,2023-03-13,2023-03-13,0,-0.60542184,at the 25 minute mark what happens when you are dealing with thousands of records and you don't memorize them all wasn't that just a mistake,neg,"['25', 'minute', 'happens', 'thousands', 'dealing', 'mistake', 'memorize', 'records', 'mark']",9,0.2584,0.078,0.0,0.922
405,405,jaganathreddygfkkwvvlly7325,2023-03-12,2023-03-12,0,0.5009909,the best one on normalization... thank you so much... but sir can you explain some more cases like what happens if we don't normalize the database only 3 anomalies will occur there can be many other challenges of demoralized data right,pos,"['right', 'thank', 'many', 'cases', 'database', 'much', 'sir', 'occur', 'normalize', 'normalization', 'one', 'explain', 'best', '3', 'demoralized', 'data', 'happens', 'challenges', 'like', 'anomalies']",20,0.6209,0.198,0.071,0.731
406,406,pavanareddy4536,2023-03-12,2023-03-12,0,-0.5980807,"do you know why the like operator is not working for the range it returns no data although there are last names in the range specified how else can i achieve the same without using or operator ism using postgresql. thanks!select first_name , last_name , contact as full_name from customers where last_name like '%' order by last_name;",neg,"['ism', 'range', 'select', 'postgresql', 'last', 'names', 'contact', 'operator', 'returns', 'although', 'customers', 'data', 'thanks', 'order', 'else', 'specified', 'working', 'achieve', 'like', 'know', 'using', 'without']",22,0.4753,0.09,0.038,0.872
407,407,pavanareddy4536,2023-03-12,2023-03-12,0,0.9870565,awesome can't wait to watch thank you,pos,"['watch', 'awesome', 'ca', 'thank', 'wait']",5,0.765,0.569,0.0,0.431
408,408,Techiegamer343,2023-03-12,2023-03-12,0,0.73980844,great explanation loved can you please provide the link to the data set,pos,"['loved', 'please', 'provide', 'explanation', 'great', 'set', 'data', 'link']",8,0.8834,0.507,0.0,0.493
409,409,suganyanatarajan2661,2023-03-12,2023-03-12,11,0.97008914,best sol trainer i you teach the thought process as well which goes a long way thank you for all the great work,pos,"['way', 'thought', 'well', 'long', 'best', 'work', 'process', 'thank', 'great', 'sol', 'teach', 'trainer', 'goes']",13,0.9169,0.431,0.0,0.569
410,410,ManojKumar-hy8wc,2023-03-12,2023-03-12,5,0.56506544,don't stop providing free content brow some people really can't afford the bootcamp course i know it takes lot of effort from you to create the content but trust me people will always remember you for what you have done,pos,"['ca', 'content', 'always', 'course', 'providing', 'bootcamp', 'really', 'done', 'remember', 'stop', 'people', 'create', 'effort', 'free', 'afford', 'trust', 'takes', 'brow', 'lot', 'know']",20,0.6801,0.168,0.042,0.79
411,411,Qwertyiopljgrd,2023-03-12,2023-03-12,0,0.8869008,best of the best,pos,['best'],1,0.8555,0.808,0.0,0.192
412,412,anvarchennai,2023-03-12,2023-03-12,0,0.54489964,"hi techtfq, you explained it well but got a doubt if data is 500 rows can we use the same method ? thank you",pos,"['hi', 'well', 'got', '500', 'method', 'thank', 'explained', 'rows', 'doubt', 'use', 'techtfq', 'data']",12,0.1406,0.177,0.12,0.702
413,413,saipradyumna9371,2023-03-12,2023-03-12,0,0.109639406,no doubt that your sol tutorials are like paid courses i had enrolled in paid courses but it had less explanation....hope your courses would get more attention,neutral,"['attention', 'courses', 'get', 'tutorials', 'less', 'hope', 'explanation', 'would', 'sol', 'like', 'enrolled', 'doubt', 'paid']",13,-0.1531,0.062,0.119,0.819
414,414,SandeepKancharla-dm6zj,2023-03-11,2023-03-11,0,-0.1988142,"sir , can you do one video on star schema and snowflakes .",neutral,"['snowflakes', 'star', 'sir', 'schema', 'video', 'one']",6,0.0,0.0,0.0,1.0
415,415,sudhanshugrover2726,2023-03-11,2023-03-11,4,0.96403635,great explanation thoufiq. always a pleasure to watch your videos i really like the way you channelize your thoughts in an easily comprehensible manner the speed clarity and content of your videos are absolutely perfect have watched other videos of yours and same opinion goes for them too coming to this one i guess you knowingly kept the sales info till the and step to explain transitive dependency though you would've eliminated it at the same time you normalized order/prod/cust info since sales just like customers was also absolutely independent of candidate keys keep up the good work,pos,"['transitive', 'speed', 'step', 'since', 'info', 'candidate', 'content', 'always', 'kept', 'knowingly', 'pleasure', 'thoufiq', 'till', 'eliminated', 'really', 'guess', 'independent', 'great', 'perfect', 'keep', 'though', 'clarity', 'keys', 'one', 'coming', 'explain', 'good', 'work', 'time', 'normalized', 'videos', 'dependency', 'thoughts', 'customers', 'absolutely', 'goes', 'channelize', 'also', 'way', 'easily', 'watch', 'watched', 'sales', 'opinion', 'explanation', 'like', 'manner', 'would', 'comprehensible']",49,0.9761,0.226,0.0,0.774
416,416,educationforseekers7558,2023-03-11,2023-03-11,0,0.9225497,well-done!,pos,[],0,0.0,0.0,0.0,1.0
417,417,souravshome2602,2023-03-11,2023-03-11,1,0.96001345,no doubt you are the best sol trainer after watching your video my all doubts about normalization is cleared never miss your single video because of you i got to know lots of concepts about sell thank you sir,pos,"['single', 'thank', 'video', 'doubt', 'got', 'sir', 'sol', 'watching', 'trainer', 'normalization', 'miss', 'best', 'lots', 'cleared', 'concepts', 'sell', 'know', 'doubts', 'never']",19,0.3907,0.201,0.145,0.653
